,names,reviews,ratings,agreed,date
707,Serenity Richmond,i feel you should be able to delete your bereal more than 2 times. and it should really give a warning. for example my friend took my phone to take it and deleted it twice now i cant post until tomorrow ruining my daily streaks of bereal. i feel like a warning should be given saying you can only delete bereal twice are you sure you want to delete it. then you accept or decline it,Rated 2 stars out of five stars,1 person found this review helpful,"February 24, 2023"
708,sofia sese,the back cam rotates in its own its so annoying like i just want to take decent pictures!! pls get this fixed,Rated 1 stars out of five stars,1 person found this review helpful,"January 27, 2023"
709,Mk,"Great concept, but the android version needs a lot of work. Whenever a try to upload, the app fails to post and the content gets deleted!",Rated 2 stars out of five stars,2 people found this review helpful,"October 24, 2022"
710,isabel harwood,"i edited my review (had 4 stars before) because im disappointed the 'video realmojis' have been removed. some can still use it, probably because they havent updated the app in a while, but it's quite sad that it's gone, since it was really nice. im very disappointed.",Rated 2 stars out of five stars,1 person found this review helpful,"December 21, 2022"
711,Eliana Troper,"Update from 2 -> 4 stars: the android app update greatly improved the quality of the app. The biggest missing feature that would round this out to a 5 star app is access to historical comments, at least for a day or two.",Rated 4 stars out of five stars,1 person found this review helpful,"December 11, 2022"
712,Adarsh Anil,This app was really a surprise for me and my friends....i never share photos on anywhere even on insta..but this is really a fun way of bringing people together.......great work from the creators. I hope this app gets more attention than now..,Rated 5 stars out of five stars,1 person found this review helpful,"December 8, 2022"
713,Julia Nielsen,I like this app because it is fun to be able to see what all your friends are up to and it's just different than the other kinds of social media. I love it!,Rated 5 stars out of five stars,1 person found this review helpful,"January 29, 2023"
714,tazia scott,"It's not my type of social media but it's definitely a cool concept, you can get pretty cool and fun photos from this. I personally wouldn't recommend but I'm also just a picky person.",Rated 3 stars out of five stars,3 people found this review helpful,"November 11, 2022"
715,Evie Brown,"so, I still think BeReal is great but I wish it went off at better times. like, between ten and nine.",Rated 5 stars out of five stars,1 person found this review helpful,"January 30, 2023"
716,Rose Fowler,"Really good app, however there are some changes that I think should be made. Instead of being able to post at any point after the notification, there should be a half an hour cut off point where you aren't able to post late.",Rated 4 stars out of five stars,1 person found this review helpful,"November 19, 2022"
717,Neo Sehlabane,Bad experience. The app idea is great but the bugs let the app down. Sometimes you images takes forever to upload. Sometime it doesn't capture at all. I was also disappointed at how I had to re-enter my details like I am new on the app after updating the app. Its just sad that I deleted all my memories and the app due to bad user experience.,Rated 1 stars out of five stars,11 people found this review helpful,"November 3, 2022"
718,Molly Budd,I love the idea and the app is great except im not reciving the notification for my bereal. Can this be fixed?,Rated 3 stars out of five stars,1 person found this review helpful,"February 8, 2023"
719,Kristian K. M.,"It could be good, but the potential is totally wasted on its poor functionality and also design in some areas. Pictures won't be posted ""wait a few moments"" forever, you can't caption it before it's posted. Just to name a few. If you want to report an error or give feedback, you're transferred to other apps (whatsapp, default mail app), which is totally ridiculous. Nobody wants to use their personal or work mail, you need to integrate that part into the app, if you actually want any feedback.",Rated 1 stars out of five stars,1 person found this review helpful,"May 20, 2022"
720,Ashton Thiessen,"The concept is kind of cool. But the app itself and the user experience is absolutely garbage. Many times I've been prompted to repost over and over, even though I've already posted. The process of adding friends is difficult and confusing. Additionally the design of the app is very unappealing.",Rated 2 stars out of five stars,1 person found this review helpful,"October 12, 2022"
721,Poonam,Amazing app to find and make new friends.,Rated 5 stars out of five stars,1 person found this review helpful,"March 29, 2023"
722,F-Xavier BORNES,"I like the concept, but only being able to download/keep your own photos at low resolution, with an ugly tag at the bottom is ridiculous. Why not leaving both photos in the gallery or at least allow to download them properly?",Rated 1 stars out of five stars,1 person found this review helpful,"December 17, 2022"
723,Serena Nassar,"I love it its a very fun way to communicate with friends and its so fun but don't forget, you gotta be real😉",Rated 5 stars out of five stars,2 people found this review helpful,"February 7, 2023"
724,Adam Quinton,BeReal used to be one of the buggiest apps and I still loved it then. Now it's much better. I have 6 friends on it and it's great to reconnect with people after seeing what we're up to.,Rated 5 stars out of five stars,17 people found this review helpful,"November 15, 2022"
725,Nirmal Bisht,I'm trying to login again but the app is showing a note that We can't resolve you're problem at the moment.Please try again later.,Rated 1 stars out of five stars,1 person found this review helpful,"March 11, 2023"
726,the Gerda,"Loved the app and did not mind the bugs until the latest Android update. Every second day my BeReals would not load at all. When they are not loading, you cannot retake them or do anything else, leaving you with no options",Rated 3 stars out of five stars,1 person found this review helpful,"November 8, 2022"
727,Katherine Jarman,Could use an update of some sort but pretty fun to look through and see what everyone's doing,Rated 4 stars out of five stars,1 person found this review helpful,"March 5, 2023"
728,Zina Abu-Haydar,"great concept but experiencing a lot of bugs in the app. adding friends doesnt always work, accepting requests either. a little more flexibility to be in charge of notifications. more 'settings' would be nice. selecting time of picture would help. some people may work or be in inappropriate settings to use their phone. freedom to select the time and have that be the same everyday would be better. only reason it doesnt have a 5star.",Rated 4 stars out of five stars,1 person found this review helpful,"July 23, 2022"
729,reputation,"The idea is really nice and i enjoy posting pictures and seeing my friends post in the moment photos too. I really dislike how buggy the app is. You can't really add people, or have a hard time doing so. Sometimes posting doesn't work, even if you try multiple times. Also the reactions are buggy and wont always post. I wish these bugs would be fixed soon, otherwise i will loose the fun in using the app.",Rated 3 stars out of five stars,1 person found this review helpful,"September 22, 2022"
730,Mychael Griffin,I love be real and it's better than Tik-Tok I like it because you can only do photos not videos keep up the good work be-real,Rated 5 stars out of five stars,1 person found this review helpful,"February 17, 2023"
731,Hatim Marley,"The app is amazing, the only downside is , android phones need the ultra wide camera on the app too !",Rated 4 stars out of five stars,1 person found this review helpful,"February 8, 2023"
732,Flynn,Everything I turn vibration off it turn back on again the next time I use the app please fix this,Rated 4 stars out of five stars,1 person found this review helpful,"March 29, 2023"
733,Jackie Beal,Super fun to do with my friends!! Also nice to know what they're up to over weekends and vacation.,Rated 5 stars out of five stars,6 people found this review helpful,"January 14, 2023"
734,Freya McAusland,I love this app! So a notifacation pops up when its time to 'be real' and you have 2 minutes to show what your doing at that moment. I love looking at what everyones doing when its bereal time! 10/10 recommend.,Rated 5 stars out of five stars,1 person found this review helpful,"November 27, 2022"
735,Usama Bin Muzaffar,"Idk what to say really. I can't even get into the app. It always says ""oops, we can't resolve your request at the moment. Please try again later!"" whenever I try to enter my phone number. Kind of a bummer really. I was really looking forward to using the app.",Rated 2 stars out of five stars,1 person found this review helpful,"December 14, 2022"
736,Lucas,"Edit: Thanks for hearing android users, now it's running perfectly. Original: Worst app I've ever used! I can't receive friends requests and add friends that already have the app! I wish I could give 5 stars...",Rated 5 stars out of five stars,2 people found this review helpful,"November 4, 2022"
737,milka simatupang,"The people around me (including myself) who just installed bereal are having trouble everytime we enter our phone number while we sign up. After we enter our phone number, it keeps saying to try again. Please fix this immidietly, thank you.",Rated 2 stars out of five stars,31 people found this review helpful,"January 2, 2023"
738,BIGBEASTISHANK,"App is great and everything is good it's just missing one feature with is of direct message or dm, if u add a dm features with video and voice calls no filters then this app is completed 😀",Rated 4 stars out of five stars,2 people found this review helpful,"January 3, 2023"
739,Jayson Dela Cruz,"Great app but my 2022 recap isn't loading. I've tried clearing all data and reinstalling the app and it still says ""Generating your 2022 video recap"". Help!",Rated 4 stars out of five stars,8 people found this review helpful,"January 6, 2023"
740,Maxime K-G,Kinda dissapointed that the app doesn't save the optional descriptions on memories. I had been doing that for over a month and now they're all gone. 😓,Rated 2 stars out of five stars,1 person found this review helpful,"January 29, 2023"
741,AndrewInnit,"Instagram, but truly a confidence boost if you don't take any pictures of yourself. Also, keeps moments of your life in just a photo library. Pretty cool in my opinion.",Rated 5 stars out of five stars,1 person found this review helpful,"January 6, 2023"
742,Catelyn Carter,I really like bereal I have so many friends on it. There are no adds and I love it. I love looking through peoples post ot is so much fun. It is my new favorite app. I started using it after I saw my aunt doing it. So I downloaded it. It is the best app,Rated 5 stars out of five stars,2 people found this review helpful,"February 4, 2023"
743,Morpheus,"I think Bereal should work more on the technology that tracks when you use your phone the most, for me, it's usually sending a notification in my school time when I leave my phone at home and go to school, so kinda glitchy ye.",Rated 4 stars out of five stars,1 person found this review helpful,"January 25, 2023"
744,Lucas,please add: -video (film a 30s clip) -the option to share whatever you were listening to/watching -viewfinder for both directions at once :) EDIT: Please fix the comments too dear god. Liking and better reply ux is a must.,Rated 4 stars out of five stars,30 people found this review helpful,"January 8, 2023"
745,Aaron King,Love the app. Notifications don't work at all though. Not for comments or when to post. Literally no other app on my phone has notification issues. Just beReal.,Rated 3 stars out of five stars,1 person found this review helpful,"January 23, 2023"
746,Wes Robertson,I was not receiving notifications. I read to Uninstall and reinstall. Now I have to sign up all over again but the code they text me won't work.,Rated 2 stars out of five stars,1 person found this review helpful,"January 9, 2023"
747,Luke Blomstrom,Android version won't allow me to download my be real with the front facing camera as the main camera. I also can't move one camera all the way out of frame in order to take a screenshot of just one camera,Rated 1 stars out of five stars,1 person found this review helpful,"January 1, 2023"
748,Hamna Athar,"Won't let me verify my phone number, gives an error every time I enter my number and won't proceed. Been trying for 3 days now, but the issue persists.",Rated 1 stars out of five stars,2 people found this review helpful,"January 7, 2023"
749,Freya Edwards,this is a really great app but my only problem is after 2 retakes you can't take another post until the notification and when I don't post I can't see others be reals but overall a good app.,Rated 4 stars out of five stars,5 people found this review helpful,"January 8, 2023"
750,Liam Cunningham,"I like the app, but I'm not to sure why when I check my request list nothing shows up. So I can't accept any of my friends requests which kinda irritates me but it'll buff out I'm sure",Rated 3 stars out of five stars,1 person found this review helpful,"January 6, 2023"
751,Ella Bramley,This app is really good. I love it but there's only one thing I hate. When you delete your bereal twice it doesn't let you take it again.,Rated 4 stars out of five stars,6 people found this review helpful,"January 1, 2023"
752,Tomass Avišāns,"I do not know if you answer to emails, but it's somewhat stupid that some people can't get the verification code. For example me and my friend can't. Just.. can't. It says it can't be sent. I am on a fully updated Samsung Galaxy note 10+. I have contacted my carrier- they don't see the problem. Others with the same device and carrier are using your app. Why can't i? Help? I have already tried contacting you on your email.",Rated 1 stars out of five stars,1 person found this review helpful,"September 15, 2022"
753,Anna L,I love the concept of BeReal but the app is extremely buggy. I've been signed out and can't get past giving my DOB to get back in. Hopefully this can be fixed and I can access my account and memories again,Rated 2 stars out of five stars,1 person found this review helpful,"November 8, 2022"
754,Tom Whitehead,"Loving the app guys but it's very buggy. 1) On some images the app crashes 100% of the time I click to open the comments. The same happens if I first click on the emojis and then try to scroll left to comments. 2) the notifications are always late, if I post the second the notification comes it's still counted as a ""late"". 3) sometimes it just doesn't let me post a comment/emoji. An error message comes up at the bottom. No matter how many times I refresh or restart the app I can't post.",Rated 3 stars out of five stars,2 people found this review helpful,"August 12, 2022"
755,Annabelle “Belle” Murray,it's fun to see what someone is doing right in that moment and also connect w/friends,Rated 5 stars out of five stars,1 person found this review helpful,"March 26, 2023"
756,Diego Rojas García,pretty good app! i love the idea of a filterless social network. no issues at all yet,Rated 5 stars out of five stars,1 person found this review helpful,"March 4, 2023"
757,Sander Vonk,"Nice concept, terrible app. It's completely full of bugs, to a point where it's sometimes impossible to place a picture. Very frustrating. Just posted a picture, posted my pictures of yesterday instead and now the one I took yesterday is deleted from memories. VERY FRUSTRATING because both were really nice pictures",Rated 1 stars out of five stars,1 person found this review helpful,"October 10, 2022"
758,Kevin Riley,it's a good app for taking photos and connecting with people.,Rated 3 stars out of five stars,2 people found this review helpful,"March 23, 2023"
759,Inesa Gudeliūnaitė,"It's really fun to see what your friends are doing at any given time, also I have found my calling! (it's to take weird pictures of myself knowing my friends won't judge) :D",Rated 5 stars out of five stars,4 people found this review helpful,"January 4, 2023"
760,Karissa Martin,Super fun way to see what your friends are up to! I've only had it a week and I already really enjoy it!,Rated 5 stars out of five stars,1 person found this review helpful,"January 16, 2023"
761,Maddison Tumlinson,I genuinely think this app is awesome! I love it and I know it's in the beginning works still but there are a few glitches. I can't really add people. I'll click on the add button and it loads for a split second and nothing happens. I also get notifications that someone has friended me and I go on the app and nothing has happened and no one is there. Love the app and will continue to use it but would love it if I could add more people.,Rated 3 stars out of five stars,6 people found this review helpful,"September 10, 2022"
762,Evan Ferraro,"It's a super fun app to share what you are doing in your every day life with your friends and family, and you get to see what they do.",Rated 4 stars out of five stars,1 person found this review helpful,"March 17, 2023"
763,Sogand Shayanfard,"I can not upload my real recently. beside that when I change my timezone, one of my favourite reals deleted by the app",Rated 2 stars out of five stars,1 person found this review helpful,"March 6, 2023"
764,John Smith,"You now can't see a preview for the front facing photo, which is really frustrating",Rated 2 stars out of five stars,2 people found this review helpful,"February 14, 2023"
765,B. D. NEBRES,"This app was great until I realized my last 2 weeks of sharing wasn't posted. As you see, when I go out, my connection is unstable. Thus, when I take a moment, I shall wait for it to be posted later. However, it doesn't, stressful. I hope you can solve this issue. Like make the app accessible for offline use too. When someone captures at the moment, let them post it at the same time despite no or fatal connection.",Rated 3 stars out of five stars,11 people found this review helpful,"December 25, 2022"
766,Kenzie Sue,"Honestly, it's really fun. Love having something to do for a minute or two. Not really any issues.",Rated 5 stars out of five stars,1 person found this review helpful,"February 18, 2023"
767,jennifer,"Really nice & easy to use! One issue though: I am using a Xiaomi Mi 9T and have a camera that is usually hidden inside of the phone, and only pops out if the inner camera is used. In BeReal, the timing between switching to the inner camera & automatical capturing the photo is too short. My camera needs 2-3 seconds to adjust to the light after it pops out. If I am in a bright or normal-lit environment, all my inner camera photos are over-exposed (plain white). A higher delay would be nice!",Rated 4 stars out of five stars,2 people found this review helpful,"September 22, 2022"
768,Valentina Mancinelli,"I really like the concept and had fun trying the app, but for the moment it's too buggy to actually use it. Sometimes the posts fail to save, I stopped receiving notifications, and adding friends is very confusing. If it gets better I'd love to start using it more.",Rated 3 stars out of five stars,2 people found this review helpful,"October 12, 2022"
769,Zylefer,"I like everything about it, except for the fact that usernames have no spaces nor capitals.",Rated 5 stars out of five stars,13 people found this review helpful,"March 23, 2023"
770,Hadley Claire,I absolutely love BeReal and it has brought me a lot new friends on reality. I just want to thank whoever came up with this amazing app and I can't thenk them enough.,Rated 5 stars out of five stars,1 person found this review helpful,"February 11, 2023"
771,Vanessa Luevano,This is...it seems to be a kids app because most of the discovery are...what it looks like 16 and under.,Rated 2 stars out of five stars,1 person found this review helpful,"March 6, 2023"
772,k matsielwa,"I would've given your app a five star but when I take my be real,the app crashes!!!! Please fix that",Rated 4 stars out of five stars,1 person found this review helpful,"March 8, 2023"
773,Pet Magy,Great spent a bit of time a day no photoshop filters etc. The idea is great,Rated 5 stars out of five stars,1 person found this review helpful,"March 9, 2023"
774,Alyssa Mcsorley,I love it!!!!! you make friends and when your friend is not near you just see what they are doing or what they did.,Rated 5 stars out of five stars,1 person found this review helpful,"March 7, 2023"
775,Mackenzie Mericle,Amazing! I just don't like that you can't repost after deleting it twice.,Rated 5 stars out of five stars,1 person found this review helpful,"March 4, 2023"
776,Sina Alizadeh,Every once in a while photos are not posted... And I don't know the reason 🤷🏽‍♂️🤦🏽‍♂️ ￼,Rated 2 stars out of five stars,1 person found this review helpful,"March 3, 2023"
777,Dana Rahime,Nice app I can easily upload pictures and also the support is very friendly,Rated 5 stars out of five stars,1 person found this review helpful,"March 1, 2023"
778,Miss,Idk what to say but it's a fun a cool app to see what your friends are up to lol.,Rated 5 stars out of five stars,1 person found this review helpful,"March 4, 2023"
779,Jack Silva,pretty nice. they need to make the friend requests easier tho,Rated 5 stars out of five stars,2 people found this review helpful,"March 11, 2023"
780,Amilcar Soriano,"It is dumb the fact that you won't let people upload their BeReal when they have the oportunity. In some cases, I am not able to do so when I have the chance to upload my BeReal",Rated 1 stars out of five stars,1 person found this review helpful,"March 7, 2023"
781,xo,it would be cool if te reactions and the captions rest saved in the memories,Rated 5 stars out of five stars,1 person found this review helpful,"March 9, 2023"
782,Lenaya D,I rate it 4 stars because it's fun and non-addtiong but it's kinda boring they should add new things to it,Rated 4 stars out of five stars,1 person found this review helpful,"March 9, 2023"
783,Mimi’s World of YouTube,BeReal is a good app but I wouldn't expect to be able to post on time.,Rated 4 stars out of five stars,2 people found this review helpful,"March 7, 2023"
784,שי-לי שלומוב,"Love bereal , easy to use , not a lot of ads .",Rated 5 stars out of five stars,1 person found this review helpful,"March 11, 2023"
785,Sarah Butler,the camera takes too long to actually take the pictures,Rated 4 stars out of five stars,1 person found this review helpful,"March 1, 2023"
786,Marley Eversley,I love bereal like the anticipation of when the notification goes off. I think though they should have a screenshot option like if your doing something interesting on your device or something but it's really good,Rated 4 stars out of five stars,2 people found this review helpful,"December 16, 2022"
787,Naomi D,Cool app that reminds you to take photos every day of whatever you're doing at the moment.,Rated 5 stars out of five stars,1 person found this review helpful,"January 27, 2023"
788,Smitty Smith,I like the idea of the app it isn't really like anything else out there. It kills the narrative of everyone is perfect and create this humbling feeling across the platform and has no ads and nothing you need to pay for in the app. The only issues I have is it's buggy and has quite a few glitches. At times it won't let you post and it also won't let you follow people even if you close the app and open it again,Rated 4 stars out of five stars,1 person found this review helpful,"August 24, 2022"
789,ecem koyuncu,The idea of this app is quite fun. But it needs to work better in technical ways. I had some problems with adding friends. And also English language is not great. App needs to work smoother also. And i think it would be great if the app had a widget to put on to the main screen. It would be easier to access and also would be funny to see my friends posts on my main screen.,Rated 3 stars out of five stars,1 person found this review helpful,"May 29, 2022"
790,Lukas Konsin,Great concept but this app desperately needs live view of both cameras and faster image taking to become functional enough,Rated 3 stars out of five stars,1 person found this review helpful,"February 5, 2023"
791,Robin Greeley,"Really fun, a great way to connect with friends and the app works really well",Rated 5 stars out of five stars,2 people found this review helpful,"January 14, 2023"
792,Danellboy,"It takes about 5mins to save my be real and i have to wait how many minutes for it to accept a caption. It's even missed my post out before it took so long. - it doesn't seem to upload in the background either, only when I go back on the app. Other than those issues (which do kinda ruin the experience) great idea for an app. 5 stars if those issues were fixed",Rated 2 stars out of five stars,1 person found this review helpful,"September 27, 2022"
793,Aidan Mills,"I can't add friends so I can't see any content I care about, I cleared the cache and tried again, I uninstalled and reinstalled but that didn't work either. they show up but I can't add them it's make it's really annoying. I think be real is the social media that I want to be using, not using TikTok or Instagram anymore and I'd like how they approach it in a very minimalistic sense. but it's unusable for me right now",Rated 1 stars out of five stars,1 person found this review helpful,"October 8, 2022"
794,Constantine,"Great idea. Though, I would prefer to view bereals from my country or somehow set a tag.",Rated 4 stars out of five stars,1 person found this review helpful,"February 5, 2023"
