,names,reviews,ratings,agreed,date
324,PERSI H,"It's poorly timed invasive app, it invites you to over share in more ways than ever before and violates more people's privacy at once. It also is a security risk. Possibly informing people of your location. Maybe not with a location but with visual information. Being real? It's a new way to be superficial",Rated 1 stars out of five stars,1 person found this review helpful,"December 11, 2022"
325,June Strømsli,"I do enjoy this app, but Only when it works. It happen alot that i get the message to take a picture but often i cant Even get in the app, its just a Black screen. So its hard to not be late. I dont like the new update too, miss that i can see the selfie side, and how/what i take picture of. Not getting to take picture when the time is there making me consider not using this app since its frustrating. I have this challange with some friends on being the fastest to post.",Rated 2 stars out of five stars,1 person found this review helpful,"November 8, 2022"
326,Charlie Beckett,Absolutely love bereal the pure creativity you get is amazing in any way using either in a normal way or an extremely funny way like I do with my friends. Overall great features and the way it works however I wish there was more settings such as delay between cameras than having to quickly time eveything and maybe having the ability to make a BeReal video and record aswell would bring amazing creativity to the app. 1 bug is when the cameras swap out of knowhere it's really annoying,Rated 4 stars out of five stars,1 person found this review helpful,"November 11, 2022"
327,Shrey Soni,"It's great. I love it. Very gen z, chic, and modern. BeReal. is my goto app to see what my friends are doing.",Rated 5 stars out of five stars,4 people found this review helpful,"February 23, 2023"
328,Gavin Whitham,"The latest update is terrible, it struggles to submit a photo as always but now sends you endless notifications as it retries, after a while it then loses the photo you're trying to upload and you have to start all over again. The developers who created this latest version should be fired, it's truly awful.",Rated 1 stars out of five stars,2 people found this review helpful,"November 4, 2022"
329,Laura K,"Something new and actually real. No filters, no photoshop, just real you. People needs more apps like this to encourage realneass.",Rated 5 stars out of five stars,1 person found this review helpful,"February 21, 2023"
330,Niko,"BeReal does everything the app tells you, you don't need to waste time on the app. The most time I spent on the app was 20 mins.",Rated 5 stars out of five stars,1 person found this review helpful,"January 20, 2023"
331,Weirdly Logical,"This is appalling. After two months, they back camera photos are still stretched and rotated 90 degrees. Please sort it out. (this seems to be a bug with Huawei (I'm also on a Y9 Prime, but idk if it's different for other models)). Overall, the app is still fairly buggy.",Rated 2 stars out of five stars,2 people found this review helpful,"December 24, 2022"
332,olivias otters,"i love this! its an amazing app and a good way to showcase what your doing, have contact with ur friends and so much more. the pictures are always good quality but sometimes when ur taking ur bereal it says ""error occured"" and u have to retake the pic. doesnt happen often though but i do recommene this app! :)",Rated 4 stars out of five stars,1 person found this review helpful,"December 3, 2022"
333,Jana Mitreska,"Great idea, just executed poorly. I'm not getting the sms code at all and I can't log into my account anymore. Please add an alternative in case the log in with a phone number doesn't work or a user loses their phone number with their account on it, for example, it'll be easier to log into the existing account through e-mail rather than try to create a new account with a new phone number if there's no option to log in with an email. It's extremely annoying.",Rated 2 stars out of five stars,6 people found this review helpful,"November 20, 2022"
334,Emily Wilson,"I love this app but my bereal memories of the year keeps failing to download. I'm not sure if this is a problem with my wifi or the app. This problem is still happening through the next day, I've emailed your contact support for some help because I can't seem to figure out what the problem is.",Rated 2 stars out of five stars,1 person found this review helpful,"December 17, 2022"
335,Stuart Johnston,"Really cool idea except the app has a few bugs. My bereals used to be just fine but now they always come out way too dark, even if I turn on flash. Sometimes my bereal refuses to upload for hours. And sometimes I open the app when it's bereal time and it's like I've never opened the app before; it gives me a tutorial even though I've had the app installed for three months now.",Rated 3 stars out of five stars,1 person found this review helpful,"November 9, 2022"
336,XVii VOiD,"At first the app was very simple and you could know when the selfie was captured. Now it is a little harder to know but that seems intentional in order to ""be real"". Also they rounded out every square in the app and personally I liked it better before. It still has some way to go but right now its worth 4+ starts for sure",Rated 4 stars out of five stars,1 person found this review helpful,"October 26, 2022"
337,Timothy Lueken,"This app was really great, but I got a new phone and when we went on bereal it said I had to make a new account and didn't give me an option to log in, so I tried to create a new account and no matter how many times I rienstall and retry to sign up, the app won't send me a message for my code, and when I try to resend it says it can't process my request. Great app overall, but I can't even use it.",Rated 2 stars out of five stars,1 person found this review helpful,"December 26, 2022"
338,Zara Moore,"Awesome idea and well executed. There are no ads and the camera quality is spectacular. The only thing I would change is to add a blur tool once you've taken the picture so block out registration plates but other than that, it's a perfect app!",Rated 4 stars out of five stars,1 person found this review helpful,"October 22, 2022"
339,Dylan Olson,I love this app because I get to have fun looking at what my friends are doing. Not only that I have so much fun getting a notification saying I can take my two pics. Don't worry about the timer you still can take pictures late. I also feel I have a goal because you have to take the picture before you look at your friends pictures but other than that I love this app so much and definitely recommend.,Rated 5 stars out of five stars,1 person found this review helpful,"December 28, 2022"
340,Ninja Fox YT,The looks of the app seemed a little weird and could use some help. And there is not enough settings or customization. I do love the concept and will continue using this. But please change the looks of the app and give it more customization.,Rated 3 stars out of five stars,1 person found this review helpful,"November 21, 2022"
341,Sebastian Meeson (Seberous),"Since the app has been updated to be the same as the IOS version, I literally cannot fault it. Works perfectly, and the UI is much cleaner. Takes some getting used to but all the little issues with the software appear to be fixed now! Excellent.",Rated 5 stars out of five stars,1 person found this review helpful,"November 4, 2022"
342,Kim Nguyen,"It has promise, but I want them to bring back the ability to save bereals in the photograph stage without needing to post it first. I also would like to bring back the ability to see what's on my camera when taking both front and back camera photos.",Rated 3 stars out of five stars,1 person found this review helpful,"November 4, 2022"
343,Scott Williams,"This is the most digestible and least time-taxing form of social media that I participate in. I've faced occasional technical issues with the app, particularly with adding friends and camera functions, but they've become fewer and farther in between with updates and I love the platform.",Rated 4 stars out of five stars,1 person found this review helpful,"October 28, 2022"
344,Gulshan D,"Sadly pictures taken from the app camera aren't as crisp as the ones from phone's default camera app on Pixel 7. Also, I wish that the app allowed at least 3 second before capturing the selfie so that we could adjust/point the camera better. Overall, interesting concept.",Rated 3 stars out of five stars,1 person found this review helpful,"November 26, 2022"
345,Izabelaa,"Great app, but there are many performance issue especially at the time of uploading. Or after, it's occurring very often. Sometime sit doesn't show any reals at all even though I posted one and rected to few of my friends' ones. A shame because I love the concept.",Rated 4 stars out of five stars,1 person found this review helpful,"November 9, 2022"
346,Sierra Donaldson,"New update is bad. There was a lot of bugs that should have been addressed, but instead they changed the UI. Now you can't see the picture it takes from your front view camera and there's a timer at the top that won't go away even when you post",Rated 2 stars out of five stars,1 person found this review helpful,"November 13, 2022"
347,Patti Quintano,"You people have some serious kinks to work out. After using the app for about a month, went to add a friend and couldn't. Updated the app. Then it didn't even give me a chance to log in, just acted like I was a new user setting up a brand new account. No way to get out of the process so I uninstalled and reinstalled. Still making me create a new account and now won't let me past validation screen. Just spins forever after entering code. Ridiculous.",Rated 2 stars out of five stars,2 people found this review helpful,"November 8, 2022"
348,sorena jafari,last version was buggy so i joined the beta version 2 month ago but after that i couldn't use bereal anymore i messaged developers but they didn't solve my problem. my problem is when i took a picture the selfie is okay but the behind picture is rotated and i can't do anything to fix it. i hold my phone vertical but the picture is horizontal. and it doesn't look normal.,Rated 1 stars out of five stars,1 person found this review helpful,"November 5, 2022"
349,Palesa Mathibe,"Great concept, a bit unreliable. I don't always get notifications for when to post even if I specifically open the app so that's annoying, having to skip days for no good reason. It's also not the most intuitive app to use.",Rated 4 stars out of five stars,1 person found this review helpful,"December 28, 2022"
350,jasmine,"It's been literally a month and my back camera photos are STILL being rotated 90 degrees and stretched. There's literally no point in me using this app if I can't send proper photos, and I can't see friends' photos without posting one. A real bummer for an otherwise fun app.",Rated 2 stars out of five stars,1 person found this review helpful,"December 3, 2022"
351,julianne obregon,"I love bereal but I'm currently having problems with the app. After i open it once and close it again, it doesn't allow me to see anyone on my friends lists bereals. It just says ""Your friends haven't posted their bereals yet. Add even more friends"" but i get notifications of them posting and reacting but it doesnt show it. Just that text above",Rated 3 stars out of five stars,1 person found this review helpful,"October 23, 2022"
352,Lewis Baden (415HolyGuyArt),Twice I've taken a BeReal and twice BeReal failed to post. I'm using Android. I'm now Uninstalling... Additional reasons why I'm uninstalling... Why can't I turn off the annoying vibrate when I toggle between looking at a front picture and a back picture? Adding friends is painfully glitch infested somehow I now have 3. I see notifications about a friend mentioning me but see no way to see the actual content! The last 2 bugs MAKE IT POSSIBLE TO TURN OFF THE ANNOYING VIBRATE.,Rated 1 stars out of five stars,2 people found this review helpful,"November 7, 2022"
353,Michelle Sue A,"I enjoy the app. It's been more fun to post now that I have a lot more friends on the app. Even if you don't have a lot of friends in the network, you still are capturing photos in everyday life you might not have. Only feedback is I wish the memories saved the caption too.",Rated 5 stars out of five stars,1 person found this review helpful,"November 5, 2022"
354,Martins Engelis,After the last update most bugs are fixed! 1. However would be nice if the new interface was less clicks. Before it was much faster to check out reaction. 2. Also the discoveries are still not in my country. 3. How about making memories public one day? 4. Where is the sad face?,Rated 4 stars out of five stars,1 person found this review helpful,"November 2, 2022"
355,Crystal Morgan,"Terribly designed, update makes it even worse You can't see when taking the photo the other camera's view to line it up or focus it. Plus then the other photo goes into the corner of the first photo, which without the preview it's hard to know where your margins are. That was a terrible idea. They also now show how many retakes you did. In what world would I want someone to know how many times I retook my bereal? That, along with the shame label if you're even a tad late, makes it aggressive",Rated 2 stars out of five stars,1 person found this review helpful,"November 12, 2022"
356,Breana (Bre),"So far awful experience. Won't let me add anyone. And is just really frustrating to use. Edit: The new update is amazing, can actually see friend requests and add people. So far it's looking good, hopefully stays that way.",Rated 4 stars out of five stars,1 person found this review helpful,"November 4, 2022"
357,Jakub Homola,"Great, but I would appreciate having a way to control the front camera, whether it is flipped or not. Also, it would be nice to have an option to also save the photos taken to the regular pictures folder in my phone.",Rated 4 stars out of five stars,1 person found this review helpful,"November 6, 2022"
358,Aun Syed,"Fun app but it's always bugging me every other day. Like can't upload bereals and have to wait a few hours to upload one while everyone else can. Sometimes you can't log in. And it has a very unusual way of logging in. Bereal, please fix. It's proper frustrating when you can't use it properly.",Rated 3 stars out of five stars,1 person found this review helpful,"November 8, 2022"
359,Paul Sileo,"App goes off at the same time every day (12:44 pacific time). Was told it was supposed to be random times throughout the day. There's also no real point to the app as there's nothing to incentivize users for using the app or posting ""on time"". This is no different than just sending a picture message to a group thread currently",Rated 3 stars out of five stars,1 person found this review helpful,"November 13, 2022"
360,Aila essof,"This keeps on saying upload failed and click to try again..I've restarted it cleared the cache, deleted it and installed it like about 10 time and I've even tried to see if I've got good connection which I do have and I've done everything I can do make it work but it simply is not letting me upload a bereal.",Rated 1 stars out of five stars,50 people found this review helpful,"November 5, 2022"
361,Joe Hartley,"Like the concept of the app but first of all it takes forever to upload most times, the photo quality is awful and accepting friend request is on another level you have to repeatedly press accept for it to work. As usual another app were they let down android users and give apple the best experience Edit: constantly getting logged out, nothing I mentioned months ago has been fixed for this reason it's 1 star now",Rated 1 stars out of five stars,1 person found this review helpful,"November 4, 2022"
362,Markus Gögele,"The core concept is good. But this app has one task and is not able to do it correctly. It laggs, takes long to take picture, does not upload the pictures correctly. It is frustrating to use.",Rated 2 stars out of five stars,83 people found this review helpful,"November 21, 2022"
363,Shania “Veenie” Von,I really liked the app before but not so much anymore after the new update. I miss when there was a small delay that way you could be in both the front and back camera of your bereals (yes i know that defeats the purpose) but it also allowed me to see a preview of what i was taking.,Rated 2 stars out of five stars,1 person found this review helpful,"November 6, 2022"
364,Senja Niemela,I actually love this app but recently it has gotten so annoying. It just got an update for andriod phones and i love the update. It doesmt work alot tho. I have restarted the app and my phone. I have tried eveything and it only works every once in a while. It is great when it does work but please fix it so it always works. I have seen before hand that my friends posted and it just says no one has posted and u cant look at ur be real. U cant comment or even look at ur realmojis. Plz fix thus. Thx,Rated 2 stars out of five stars,21 people found this review helpful,"October 23, 2022"
365,Ethan,"A fun app for friends, my only issue is that sometimes it just doesn't upload your photos. I usually have to stay in the app and watch to make sure they were uploaded. Regardless of whether I'm on data or wifi or whatever my reception is.",Rated 4 stars out of five stars,1 person found this review helpful,"December 12, 2022"
366,dancerAsh,It is an amazing app with a ton of fun things. no glitches no ads so much fun. How the game works is at a random time of day you'll get a message saying its time to post then you'll get to post your BeReal and react to all of your friends! its a fun game to go on when your board and just need something to look at and participate in.,Rated 5 stars out of five stars,1 person found this review helpful,"November 19, 2022"
367,Matthew Burnell,"BeReal fantastically executes in delivering a refreshing take on social media. I just have one complaint. The app is not accessible to left-handed scrollers. I want a mode where selfie frames appear on the right by default. Until then, three stars.",Rated 3 stars out of five stars,1 person found this review helpful,"December 7, 2022"
368,Backyard Bee Performance,"Currently not the best, I have just tried to upload a profile picture and more then once it's told me that this operation couldn't be completed... I've tried adding friends from my phone list and they haven't been registered as invites sent or even received... if I am to be real here I'd say my experience has been weighed, tested and found wanting.",Rated 1 stars out of five stars,618 people found this review helpful,"November 16, 2022"
369,mae,"great concept, disappointing execution. i rarely ever get notifications which makes my bereal late by hours, today i got a notification but the photo i took didn't actually upload. i closed the app and it made me take a new photo which has been ""posting"" for 15 minutes. there's no problem with my internet connection.",Rated 3 stars out of five stars,9 people found this review helpful,"November 8, 2022"
370,Candie Oberg,"I think it's a cool concept but as an android user I want to be able to zoom out more and I also want to take the front and back pictures separately, at least 5 by seconds apart. :) Also a panoramic picture mode I think would be really cool 👍👍",Rated 5 stars out of five stars,36 people found this review helpful,"December 16, 2022"
371,Taylor Turner,"No fake filters, no fake lives needed. a A better perspective of what real people are, not Instagram models. A down to earth app that's helpful to transition away from toxic social media, and to understand that not everybody has to be perfect, beautiful, rich, or doing something interesting to be posting in public.",Rated 4 stars out of five stars,15 people found this review helpful,"November 8, 2022"
372,Swathy Stanley,"App is cool with fresh concept. I'm really impressed by it's beReal photos, but it would be more convenient and interesting to use if it had more than one beReal taking options per day. Like, make it five per day or somethin. Let us share a moment when we feel like one",Rated 3 stars out of five stars,40 people found this review helpful,"November 22, 2022"
373,Rowan B,"I love this app so much! Almost everyone has it at my school, and asking someone for their bereal is just as common as asking for their phone number or Snapchat now. Everyone loves it and everyone has it, we'll be sitting in class and a cacophony of bereal notifications will go off at once. You'll see bereals people took with teachers, friends, I've seen a few with the principal, it's all good fun. And the app works great too, love this app!",Rated 5 stars out of five stars,1 person found this review helpful,"November 7, 2022"
374,Sofia_Ogorman,"When i first downloaded BEREAL, everything was fine. The app worked well and it was fun. But recently a new update came out. When taking a bereal, you can't see what angle the selfie parts gonna be like, so you have to keep retaking it. Also, the app for some reason signed me out of my account. And i tried making a new one or logging in and it won't load or work. I sadly am not able to use bereal anymore",Rated 3 stars out of five stars,2 people found this review helpful,"November 11, 2022"
375,Lola Hamers,"I like the app, but it has a lot of problems. For example, why is there no normal login page? I just got logged out and I can't just log in, I have to 'get started' and enter my name and birthday again. Still, this worked for me previously, but right now I get stuck after entering my birthday and can't log in at all. I also absolutely HATE the touch feedback. I have that turned off in my phone settings, I don't want it. Let me turn it off.",Rated 2 stars out of five stars,1 person found this review helpful,"October 29, 2022"
376,Sam Duro,"With the last update the map has stopped working, when I click on the location nothing happens I have tried reaching out to you by email with no response so now trying this way. I have tried to resolve the issue by clearing cashe and uninstalling and then reinstalling. (Samsung A12)",Rated 1 stars out of five stars,1 person found this review helpful,"November 13, 2022"
377,Benjamin Cooper,"I know it's possible to get around it, but I feel the double camera should be optional or easier to take separately, I don't want my face in every picture and I know for a fact I'm not alone here... Otherwise a decent social media and fun concept :)",Rated 3 stars out of five stars,30 people found this review helpful,"December 3, 2022"
378,Jiri H,"Still buggy after many updates. I dont understand why after every update it treats me like a new user. Also the friend list is buggy as hell. You can press add friend 12 times and nothing happens. I enjoy the idea, all the bugs eats away from the experience",Rated 3 stars out of five stars,1 person found this review helpful,"November 12, 2022"
379,Charlotte Corke,"Fun way to keep in touch but frustrating that it doesn't keep track of whether you've seen late posts by friends, so you end up missing them completely if it goes into the next day - happens a lot when they're the other side of the world and so time zones are 11 hours out!",Rated 3 stars out of five stars,1 person found this review helpful,"December 3, 2022"
380,Bianca Fung,"It's such an interesting app, and have really enjoyed using it!! I'd give a higher rating if if weren't for the fact that i have 2.5 weeks of memories missing for no apparent reason - i have posted every day so its weird that theres a random gap (between 21st of Nov until 8th Dec)",Rated 3 stars out of five stars,7 people found this review helpful,"December 22, 2022"
381,Małgorzata Jasińska,"In the beginning, everything was ok. After the update, I started to have a problem with taking pictures with the front camera. Photos started to rotate and stretch. I wrote to support but no one for about 3 weeks wrote me back.",Rated 1 stars out of five stars,30 people found this review helpful,"November 26, 2022"
382,Sadeel Salem,I really enjoy this app because I have so many friend on the app and it's just a super fun app over all. And if you just wanted to add something extra to the app maybe like do videos with not filter? Kind of like if you were doing a tik tok but this one has no filters and it's still you can still pick if it's only for freinds or for discovery. So yeah but you don't have to do it it's just a suggestion and otherwise this app is a really good app 🙂,Rated 5 stars out of five stars,76 people found this review helpful,"November 8, 2022"
383,Nicolas MacBeth,"EDIT: Put back to 5 stars because the quality has bumped up by a lot with the latest update/refresh. Buggy as hell, no need to pinpoint a specific bug, they're everywhere. Super cool idea but seems the development has stalled and bugs don't get squashed.",Rated 5 stars out of five stars,96 people found this review helpful,"November 10, 2022"
384,Poca Land,"Hello, I have a problem with the app right now. When I open it, it's doing what it did the first time I open the app, asking my name and my birth date, but even when I give these infos, it doesn't continue. I tried to turn off and on my phone, then I uninstall amd reinstall the app, but nothing worked. I hope that something can be made, I don't want to loose the memories I made on BeReal...",Rated 3 stars out of five stars,1 person found this review helpful,"November 3, 2022"
385,Mollie,The app is so full of bugs and glitches I can't even use it. It's a great app *when it works*. Newest bug is that the app just stays black when opened either manually or through the notification. Absolutely unusable.,Rated 2 stars out of five stars,41 people found this review helpful,"November 16, 2022"
