,names,reviews,ratings,agreed,date
1152,-Emma -,"I would have to give this a three because it would be fun, but I get how it would be super annoying when your trying to do important things, and then your friends are pestering you to take a pic like everyone else, and also I'm on my 5th re-download because of all the bugs, like when I want to friend someone.. It's doesn't friend? It just loads and doesn't do anything. Please fix this!!",Rated 3 stars out of five stars,1 person found this review helpful,"August 30, 2022"
1153,Liam Rotheram,actually so fun. the servers can't handle the surge sometimes but it's literally not the end of the world.,Rated 5 stars out of five stars,1 person found this review helpful,"November 4, 2022"
1154,goof crossing,"very cute idea, very well executed also as far as im concerned",Rated 5 stars out of five stars,2 people found this review helpful,"March 9, 2023"
1155,Moon's not here,Really fun to just take pictures on since I don't have snap :),Rated 5 stars out of five stars,2 people found this review helpful,"January 28, 2023"
1156,Jonah Holland,"I have a bug where I can't load my bereal recap... it constantly says ""OOPS! Download failed. Click to retry""",Rated 4 stars out of five stars,1 person found this review helpful,"January 1, 2023"
1157,A. Yiğitalp Demirci,"UI acting weird, and sometimes occurring a problem when uploading photos and adding friends.",Rated 3 stars out of five stars,2 people found this review helpful,"November 8, 2022"
1158,Austin Garcia,Really good but not perfect but like everyone at my school has it and got it after I did so I recommended it and it's blew up,Rated 4 stars out of five stars,1 person found this review helpful,"January 26, 2023"
1159,Marcus Santiago,"Social media definitely needs a refresh. But this probably isn't the way to do it. Bizarrely difficult interface, my friends can't see anything I post and I can't see their posts. Half the time I post, it won't upload or uploads with ""only you can see this"" regardless of my settings. Which makes this all kind of pointless. Social media does need to change and be more healthy. But this is ultimately a gimmick at best, you'll get bored of it in a few days tops.",Rated 1 stars out of five stars,1 person found this review helpful,"November 16, 2022"
1160,Javier Rio de Andrés Gonzalez,Be real is a cute way to socialise with people while showing what you are doing but it is hard to find your friends if you don't have their phone number....,Rated 3 stars out of five stars,1 person found this review helpful,"January 9, 2023"
1161,Noah Massi Yuri,Bro your app dont work. It worked ones then logged me out because the app I just stupid then when I wanna log in it never sends me the vertification text and I cant use the app. FIX YOUR APP,Rated 2 stars out of five stars,1 person found this review helpful,"November 14, 2022"
1162,Amelia Eliza,Really fun! Makes people see your life with no filters.,Rated 5 stars out of five stars,2 people found this review helpful,"February 7, 2023"
1163,A. V.,"Despite the fact that it requires your number to create an account, which I find absurd, I did install it, and I got to say it's quite fun, tho I think it still needs some polish. First, I think you should be able to also save the caption, not just the photo as a memory, and also sometimes your reaction doesn't register, which is a bit annoying. Other than that I think the app has a lot of potential and I look forward to its development and future features!",Rated 4 stars out of five stars,1 person found this review helpful,"August 7, 2022"
1164,Ally Mears,I love this app to connect with friends on the daily.,Rated 5 stars out of five stars,1 person found this review helpful,"March 1, 2023"
1165,Tea a_m.s,"I really like the app and the concept of it, but what really bothers me is that sometimes instead of upploading the pictures i just took, they uppload the pictures that i did yesterday, so when sometimes i do something cool it happens that i don't have a ""memory"" of that event in the app because it bugs and shows the ones that i did in the past. Or one time it happened that it showed a pic that i absolutely didn't take. I don't know if i ended up with the pics of someone else but yeah.",Rated 4 stars out of five stars,1 person found this review helpful,"September 6, 2022"
1166,Karl H,"I've been using Bereal for several months and I really like the concept. However the app really needs to be improved. The most frustrating thing is adding friends. People have told me they've sent me friend requests, but I don't see them. And I've sent friend request to people but they've never received them. Please fix this android app",Rated 2 stars out of five stars,9 people found this review helpful,"October 1, 2022"
1167,Meaghan B,"never have any functionality issues, and i love being able to see what my friends are up to!",Rated 5 stars out of five stars,1 person found this review helpful,"December 13, 2022"
1168,Davide,"Shaming people for not answering to a notifications within 2 minutes is bad tbh Edited in light of the reply: yes, ""posted X time late"" is exactly what I'm talking about. Surely you'll convene that providing the time of posting would be a healthier option, and it would also give more information to your other users instead of having them do the calculations in their mind. ""This was posted 6 hours.. after.. whatever yesterday's notification time was.. so.. eh who cares. 6 hourse late tho, lol.""",Rated 2 stars out of five stars,1 person found this review helpful,"December 14, 2022"
1169,Luana Munteanu,"i absolutely love the idea of the app and i am obsessed with it, but sadly, it's a pain to use and annoying. posting does not work sometimes. changing my profile picture is impossible, since the app just crashes when i confirm the picture. and don't get me started on accepting friend requests. that is by far the most annoying part, when i feel like deleting the app: i press the ""accept"" button 50 times, nothing happens, i close the app and open it again and it still doesn't work :))",Rated 3 stars out of five stars,2 people found this review helpful,"July 24, 2022"
1170,Sofie F,"wont send me the code for my phone number. I have made sure i put the number in right, undownloaded, redownloaded, everything. I just never get the message.",Rated 1 stars out of five stars,1 person found this review helpful,"November 16, 2022"
1171,Joey Prever,"enjoyable app, but full of bugs on Android. sometimes posts previous picture instead of the one I just took. Not quite clear when a picture has been posted and what it is still being uploaded. seems to take a long time to upload most of the time. can't add captions until the upload is done.",Rated 3 stars out of five stars,2 people found this review helpful,"October 6, 2022"
1172,Aliezeh Zubair,its a good app but when I tried to log in from another phone it says that they can't do my request right now???? look I want to log into my account so please fix this issue,Rated 3 stars out of five stars,2 people found this review helpful,"January 9, 2023"
1173,Giovanni Cristallo,"Great update, for me you can implement the Refresh command, can be something great. Is important let this last update mandatory to continue using the application",Rated 4 stars out of five stars,1 person found this review helpful,"October 20, 2022"
1174,WolfeyArcher20 Gaming,It's an interesting concept and it's a way for me to have a new kind of connection with my friends..,Rated 5 stars out of five stars,1 person found this review helpful,"February 18, 2023"
1175,James Corcoran,Good app when it works but new update while fixing reaction lag added a lag on the selfie camera so the image is different to the one shown when you press the button,Rated 4 stars out of five stars,2 people found this review helpful,"November 7, 2022"
1176,Alana Heidelberg,Pretty good app just glitches once in a while.,Rated 4 stars out of five stars,1 person found this review helpful,"March 21, 2023"
1177,Jacob Cole,New app design is absolutely incredible compared to last. You guys are the absolute best. Keep being awesome,Rated 5 stars out of five stars,4 people found this review helpful,"October 25, 2022"
1178,katja korotaj,"i love the app it's really entertaining and humbling, however it still has some bugs. I am currently unable to add friends and the reactions on discovery don't work from time to time. it is build on an amazing concept and it would be greatly appreciated if the developers worked on these bugs in order to improve BeReal.",Rated 4 stars out of five stars,3 people found this review helpful,"September 5, 2022"
1179,Panadayana,"Dislike the update, needs like a 2 second preview before taking a picture now it's always blurry bc I don't know when the second picture is being taken leading to retakes",Rated 1 stars out of five stars,4 people found this review helpful,"November 26, 2022"
1180,Catalina Janick,"Cool, but the friend requesting is very broken. The add friend button barely works, and I never get anything for friend requests. I always have to search them, and then wait and wait for the button to work to add them. If this could be fixed, it would be stellar.",Rated 3 stars out of five stars,1 person found this review helpful,"October 5, 2022"
1181,Digambar Patil,I believe in reality so I loved Be real by my heart ❤️.The interface is so impressive and user experience is the best thing.The best part of Be real is I spent less time than other social media platforms.,Rated 5 stars out of five stars,1 person found this review helpful,"November 14, 2022"
1182,smh sanne,"Love the app, but 1 star because after re-downloading it I couldn't get back into my account again. I've been trying for three days now and still no luck",Rated 1 stars out of five stars,2 people found this review helpful,"November 9, 2022"
1183,Haley Swift,I love BeReal though it is a bit weird to use it is an amazing app!!,Rated 4 stars out of five stars,1 person found this review helpful,"March 30, 2023"
1184,Deborah Jones,Good cool should add some more details so that people could go on it more,Rated 4 stars out of five stars,1 person found this review helpful,"March 7, 2023"
1185,Aiden,"Super fun and kinda comforting to see all your friends doing whatever they're up to - adding people has a bug though, when i press the add button it just doesnt do anything, probably will be fixed soon as it seems like a common bug among my friends so its probably already been reported. In conclusion, great app if you have friends to do it with, and if you dont have friends, there's always the discovery tab. Super simplistic yet isnt bland. I love it",Rated 4 stars out of five stars,2 people found this review helpful,"September 14, 2022"
1186,Vida Blackmoor,"Android: I can't even make my account 🤣 bug at username stage, bug at birthdate stage the 2nd time i tried. And the app was JUST updated.",Rated 1 stars out of five stars,1 person found this review helpful,"November 17, 2022"
1187,Alexis L,"Like most of the other complaints, there's a bug somewhere and this one repeats pics. I'll take a picture of what I'm doing, but it doesn't save and I get a repeat of the same picture I took the day before instead. :( Half my memories are gone because half of them glitch into a previous picture.",Rated 3 stars out of five stars,1 person found this review helpful,"October 7, 2022"
1188,Safaa Smidi,"Love the concept but so much room for improvement. It's not user friendly. I don't know how to accept friend requests and don't know if the ones I added are added or not and when. I see the notification that someone commented but I don't know how to access that comment if the notification is gone. The interaction experience as a whole is too poor. I hope the people in charge fix this, otherwise I may as well just delete the app.",Rated 3 stars out of five stars,1 person found this review helpful,"September 23, 2022"
1189,Marisa Jairam,I uninstalled the app because my post wasn't uploading and now it won't let me get past my birthday when trying to log back in. Please fix this!!,Rated 2 stars out of five stars,1 person found this review helpful,"November 10, 2022"
1190,Colin Burrell,"On Android - invites dont come in, it crashes randomly which make an otherwise good fun app totally frustrating.",Rated 1 stars out of five stars,1 person found this review helpful,"November 4, 2022"
1191,Kyla Davis,"It's an interesting platform, to be sure. But it doesnt feel very social?",Rated 4 stars out of five stars,1 person found this review helpful,"March 12, 2023"
1192,Monkey Business,Boring. Cant do anything beside upload your picture when they ask for it. Neighter it feels intuitive. Nothing else to do on the app,Rated 2 stars out of five stars,1 person found this review helpful,"November 8, 2022"
1193,Leo Durrant,good way to socialise with your friends on a consistent basis. app is a little buggy.,Rated 4 stars out of five stars,1 person found this review helpful,"January 1, 2023"
1194,maddison flavin,"I love BeReal, but it takes WAY too long to get a notification, and whenever I do, it's at the worst times.",Rated 4 stars out of five stars,1 person found this review helpful,"December 7, 2022"
1195,Kelley Fisher,"Absolutely love the idea of this app. When it works, the app is great and fun. But for the past week, I have had so many errors I am about to give up. Today, my picture is still sending/loading from yesterday. 2 days ago I snapped my pic and instead of my new picture, the same picture from the previous day posted. It is frustrating.",Rated 3 stars out of five stars,1 person found this review helpful,"May 26, 2022"
1196,Shannon Alexander,I like the concept but have to agree it's plagued with bugs. All my notifications in the app and in my phone settings are on but the app notifications don't come thru. I finally got it to accept friend requests but now it keeps prompting me to post before I can see their posts but my posts don't stick. It says the photo has uploaded and then it disappears and prompts me to take another.,Rated 3 stars out of five stars,13 people found this review helpful,"July 29, 2022"
1197,Chris McLarry,"It will be a great app when it actually works, for now it's broken as hell. Like everyone else I'm completely unable to add friends or accept requests. Also the links people post on other socials to add them do absolutely nothing but take you to the app store. It's a bit dumb releasing a social media app no one can be social on. I'm also having issues with posting pictures, this works most of the time but on occasion, regardless of Internet connection and speed it just refuses to load at all.",Rated 3 stars out of five stars,1 person found this review helpful,"October 10, 2022"
1198,Samantha Q Nila,I like the idea. It's easy to set up and share. But the app continues to not post my photo during the time limit and then says that didn't post so I can't see anyone. It would also be nice to be able to caption before posting because of the issue of never knowing when it will actually show on my calendar. Usually it shows up a day late.,Rated 4 stars out of five stars,1 person found this review helpful,"May 1, 2022"
1199,Raphael Johnson,it's alright sometimes the notification doesn't sound :/,Rated 3 stars out of five stars,2 people found this review helpful,"February 17, 2023"
1200,Ian Thompson,"great app, better idea. but this app is very buggy. I cannot post a BeReal. it captures the picture but does not upload it to the app. i can't see my friends posts either because of it. I have uninstalled and redownloaded the app and the problem is still prevalent. Phone has been restarted multiple times and still nothing. please fix this.",Rated 1 stars out of five stars,1 person found this review helpful,"May 1, 2022"
1201,Vilmer Zander,"I like the concept. It's fun and social to be posting at the same time as your friends. The app theme is dark, the UI is okay (not bad, but not amazing). Would probably give 5 stars if the user base was bigger. So far I've only successfully ""recruited"" 3 friends. People are not willing to join new social media before everyone else has, unfortunately.",Rated 4 stars out of five stars,1 person found this review helpful,"September 4, 2022"
1202,littletemmiecat,"I love the idea of Bereal and I've gotten in contact with quite a few friends. It's a nice and simple app. It takes quite a long time to upload photos most of the time though, through both 4G and my 100mb+ WiFi (household of gamers, haha!) Definitely a software issue rather than my connection. It just seems to hang on the upload sometimes.",Rated 4 stars out of five stars,2 people found this review helpful,"May 20, 2022"
1203,Mareuss Butnorjus,"it's fine, but I can't see any friend suggestions except from phone numbers, and none of mutual friends get suggested for me aswell......",Rated 2 stars out of five stars,1 person found this review helpful,"December 1, 2022"
1204,Space Cat,The notifications don't work at all 👌,Rated 1 stars out of five stars,2 people found this review helpful,"January 17, 2023"
1205,Emanuele Scarsella,"Simply too many bugs... The worst of all is that when I don't get the notification to post, if I open it and post something that upload never ends blocking the entire app until I reinstall it... If you can't get operations to work 100% of the times at the very least give mi the option to try again o put a simple timeout to stop post if it keeps failing indefinitely... I thought this kind of stuff was figured out decades ago",Rated 1 stars out of five stars,2 people found this review helpful,"September 20, 2022"
1206,Bryan Evans,"Concept is cool, but the app is super buggy. Content in my feed constantly switches between being hidden and not hidden even though I've posted my BeReal post for the day (the app goes back and forth in thinking I haven't posted yet). The overall posting process is too slow. It needs a more immediate feedback that the post has gone through. Most of the time I just sit there unsure if the post was successfully uploading or not.",Rated 3 stars out of five stars,2 people found this review helpful,"May 3, 2022"
1207,Zuhdi Abyan,"sms verification is always failedd.. dont knpw how but ive been trying for many month but is still the same, the app just give ""oops, we cant resolve your request at the moment, please try again later"".. hhhhh",Rated 1 stars out of five stars,1 person found this review helpful,"December 17, 2022"
1208,matt zam,Its a good app But there should be able to post videos.,Rated 4 stars out of five stars,1 person found this review helpful,"March 7, 2023"
1209,Jamie Beattie,"I loved BeReal before the recent update, but now after the update I love it even more! The app has a much better look than before and functions really well now.",Rated 5 stars out of five stars,1 person found this review helpful,"November 2, 2022"
1210,Leona Cowey,I got it recently and I've been loving it so far but I can't update my profile picture it just stays as the generic one.,Rated 4 stars out of five stars,1 person found this review helpful,"February 12, 2023"
1211,Kathy B,"Fun when it works. Many times I will post but I can't see any pics, just comments. Very frustrating.",Rated 2 stars out of five stars,1 person found this review helpful,"December 14, 2022"
1212,Kaylee Quick,So far it's been a really fun and amazing experience I highly recommend getting it,Rated 5 stars out of five stars,1 person found this review helpful,"March 28, 2023"
1213,xavier baggett,"y'all need better post times, it's always around the same time every day, do better.",Rated 3 stars out of five stars,1 person found this review helpful,"January 16, 2023"
1214,-ہادی,It's very good to have this app and also I'm new so time by time l wanna see some more pleasure 💓,Rated 5 stars out of five stars,1 person found this review helpful,"February 2, 2023"
1215,Harrison Sills,"The idea is there! It's just that the app itself leaves much to be desired. Adding friends sometimes takes hundreds of attempts over multiple days, even though there is a timer sometimes the post will take longer to go up than the timer gives you, and overall the app could be much more user friendly.",Rated 3 stars out of five stars,2 people found this review helpful,"September 10, 2022"
1216,Ayden Jablonski,this is an amazing app to see what your friends or family are doing at the moment and to connect with them! 10/10 recommended!!,Rated 5 stars out of five stars,1 person found this review helpful,"November 24, 2022"
1217,Austin Shewchuk,"I like the idea of the app and it isn't necessarily bad, but there are many issues with it. First of all, us Andriod users can't see friend requests. Hopefully they will find a way to fix this in the future. I'm sure they will. But that's not all. Constant crashes and having to repost because apparently the first post didn't post. It's a bit confusing. I think this app have great potential but it just needs a bit of clean. I fully support it!",Rated 2 stars out of five stars,22 people found this review helpful,"September 18, 2022"
1218,Giada Grimm,After I entered my age it wouldn't let me continue although I reach the age limit. I don't understand what is happening I just installed it and I can't even log in. Is there anyway this can get fixed?,Rated 1 stars out of five stars,1 person found this review helpful,"November 26, 2022"
1219,Mihaela Mihaylova,my bereal can't upload. i've tried both through wifi and data and this has happened a few times already. idk what update you made but it sucks,Rated 1 stars out of five stars,2 people found this review helpful,"October 22, 2022"
1220,Sam Jordan,Logs me out every day and then makes me re-enter details. After that it fails the robot check every single time. Currently unusable,Rated 1 stars out of five stars,1 person found this review helpful,"November 12, 2022"
1221,Fazle Rabbi Spondon,"This app needs serious work. Very much buggy. Even the ""add friend"" option doesn't work most of the time. Also there's no way to interact with incoming friend requests. Social media or not, if your app isn't even able to connect two people properly despite their own intended action, then what's the use of your app? Connecting 2 people with the friend request and add friend option, is the very basic thing this app needed. If you can't even do so, then why did you release it???",Rated 2 stars out of five stars,2 people found this review helpful,"September 11, 2022"
1222,MarkosH-EST,"no way to get account onto new phone, otherwise awesome app",Rated 2 stars out of five stars,1 person found this review helpful,"March 16, 2023"
1223,Heather Willens,Super buggy app. The last two days I have posted my photo and after struggling to load it it goes back to blurry photos and telling me to post my own in order to see. What's going on hasn't this app been out for over a year why is it having so many issues? Also had a very difficult time accepting a friend request when the button did nothing and then at some point it just resolved itself. Also settings crash or open my messages app instead. Fix the app!,Rated 1 stars out of five stars,1 person found this review helpful,"May 1, 2022"
1224,Ryan D'Albeos,"the selfie got so lag, you miss important pic... solve this! you want to be the new soc med? then fix this",Rated 1 stars out of five stars,1 person found this review helpful,"February 8, 2023"
1225,Jonathan Logan,"This app is so busted on Android. Doubt it will ever be fixed too. Can't see friend requests, can't add friends when I search them... simple as that. There's other issues but the lack of being able to connect with friends kinda defeats the purpose of the app immediately.",Rated 1 stars out of five stars,1 person found this review helpful,"October 27, 2022"
1226,꧁Despair Karma꧂,"Ads, Slow, Not really worth it",Rated 2 stars out of five stars,1 person found this review helpful,"March 25, 2023"
1227,Waved Bollywood,It s a new concept....but I wish if you can allow comments on photos that will be great .,Rated 4 stars out of five stars,1 person found this review helpful,"January 21, 2023"
1228,Leyu Chang,I lovee this app idk why 😅 but i just love it. I can see my friends story's! ❤❤,Rated 5 stars out of five stars,3 people found this review helpful,"February 8, 2023"
1229,Nemi Lindoff,"Super slow. Takes at least 2 minutes to post a single picture, won't even work when i restart the app",Rated 2 stars out of five stars,3 people found this review helpful,"November 21, 2022"
1230,Emily Waters,I really like the idea but the app is glitchy. Ive tried restarting my phone and redownloading the app but it doesn't work. I cant add friends as nothing happens when i click on the button. Sometimes itll randomly add the people I've been trying to but half the time it doesn't. Often when i post a bereal it posts late even tho i was on time and ive had it glitch before so half of my photo was from a different day so I've lost the background i took that day (only bitter cause it was a good one),Rated 2 stars out of five stars,1 person found this review helpful,"September 12, 2022"
1231,Jesse Chen,"Right now on Google Pixel 7 Pro, it's impossible to send or receive friend requests. Update 11/11: fixed",Rated 4 stars out of five stars,1 person found this review helpful,"November 12, 2022"
1232,Baylie Hughes,i love this app! its been so fun to keep up with my busy friends and family! and I love that I can download my old photos!,Rated 5 stars out of five stars,1 person found this review helpful,"December 31, 2022"
1233,Aristeidis Karalis,"My initial review was 3 stars but since the app for an upgrade I add another star, although there are plenty of things that can be improved still.",Rated 4 stars out of five stars,2 people found this review helpful,"November 2, 2022"
