,names,reviews,ratings,date
0,Micah Curry,"It's fun, for me it's worth it. It doesn't get nearly as many updates as the IOS version which is super annoying, so there's features that they can do but I just cant. I also had trouble leaving the app just now. I just couldn't get away from it. I had to change my volume, and click more options so my phone would take me to sound settings. Uncommon problem. Lowered to two stars cause of how much they neglect Android. pretty darn annoying. edit again, app basically has cobwebs. android hate smh",Rated 2 stars out of five stars,"March 25, 2023"
1,Saraiah Jeanjacques,"This is a good app to stay connected to friends, but it is definitely biased. I don't have an Iphone, and there is a lot of things that my friends can do that I can't. It's a waste of time to send a message on thus app, but then I have to remind them that I can't see it because yall dont want to give samsung users the same updates. When yall change that, I will be happy to change the rating I gave this app.👍🏽",Rated 2 stars out of five stars,"March 21, 2023"
2,Kyra B. (Lucy Brucy),"So basically it's a great app and stuff but it's obviously meant for iOS products, not Samsung. The only reason I'm giving this app a one-star review is bc it doesn't sync up the features provided with iOS. For instance, you can message/ contact people through the app on iOS but on my phone, it doesn't let me. It'll give me the notification that someone responded but I can't see what they said. So it's getting annoying at this point. Please fix it.",Rated 1 stars out of five stars,"March 15, 2023"
3,Micah Curry,"It's fun, for me it's worth it. It doesn't get nearly as many updates as the IOS version which is super annoying, so there's features that they can do but I just cant. I also had trouble leaving the app just now. I just couldn't get away from it. I had to change my volume, and click more options so my phone would take me to sound settings. Uncommon problem. Lowered to two stars cause of how much they neglect Android. pretty darn annoying. edit again, app basically has cobwebs. android hate smh",Rated 2 stars out of five stars,"March 25, 2023"
4,Saraiah Jeanjacques,"This is a good app to stay connected to friends, but it is definitely biased. I don't have an Iphone, and there is a lot of things that my friends can do that I can't. It's a waste of time to send a message on thus app, but then I have to remind them that I can't see it because yall dont want to give samsung users the same updates. When yall change that, I will be happy to change the rating I gave this app.👍🏽",Rated 2 stars out of five stars,"March 21, 2023"
5,Kyra B. (Lucy Brucy),"So basically it's a great app and stuff but it's obviously meant for iOS products, not Samsung. The only reason I'm giving this app a one-star review is bc it doesn't sync up the features provided with iOS. For instance, you can message/ contact people through the app on iOS but on my phone, it doesn't let me. It'll give me the notification that someone responded but I can't see what they said. So it's getting annoying at this point. Please fix it.",Rated 1 stars out of five stars,"March 15, 2023"
6,Vincent Heinzmann,"Great app in a lot of ways, although it needs to stop catering only to iOS. As someone who switched from an iPhone, I realized Android Locket is missing features such as the entire messaging system they have on there, so instead of my friends sending me an in app message, they have to send me an SMS message instead. Like I said, it's a great app, but until this company stops only updating the iOS version, I have to give it two stars.",Rated 2 stars out of five stars,"March 10, 2023"
7,Kayla Allison,Great idea! But needs improvement. I love being able to see photos of friends without the millions of ads. But we need the same features as ios. Friends will comment on my photos and I can't see them because the messaging feature is unavailable for Android. Fix that and this ap will get 5 stars.,Rated 3 stars out of five stars,"February 21, 2023"
8,Vanaah,"The app is fantastic and an adorable means of communicating with friends. However, it takes an embarrassingly long time to update the Android app. The reply feature in app has been available to ios since early December. Android to iPhone photos look crunchy for no reason. We don't have the rewind feature, separate widgets, or even the ability to zoom in on photos. This app on android is so neglected and poorly optimized as well. I hope this changes soon.",Rated 2 stars out of five stars,"January 11, 2023"
9,Donovan Sheets,"This app has great potential, it's working with a fantastic idea. Unfortunately it's really not there yet as far as technical development. Issue 1: it is very buggy still. Camera being cut off, crashes, etc. Issue 2: very feature light. The android widget is not resizable and very space inefficient. You can't upload photos taken to it. No way to configure the flash options (screen brightness or white flash for selfie). Fix these and it's an easy 5 star.",Rated 3 stars out of five stars,"December 1, 2022"
10,Izzy DeLeon,"I feel like Android users are neglected. My friends have apple and they can do all different things than I can. First it was the adding a description to your post. My friend had it for about 2 months before I could. And now it's commenting on post my friends have has it for a bit(idk how long) and I can't see them nor comment. Please try and resolve these issues. It's very annoying and lowers have a good experience with the app. Other than that,.it's a pretty decent app. I would love to see more",Rated 3 stars out of five stars,"January 13, 2023"
11,kaiden ritchie,i love locket! its a perfect way to keep up with your friends and share cute moments! i have no complaints other than its a little slow at times but that could also just be my internet connection. also i wish you could have more than 20 friends. at least 25 but it'd be better if there was no limit. another thing that i would like to add is a gallery option. this would be AMAZING! this app is so cute and creative. me and my friends love it!,Rated 4 stars out of five stars,"November 7, 2022"
12,Victoria Brownlee,"its cool but there could be more to like being able too change the color of the text and move it too any designated spot, being able too see who did the sender send the locket too like if it was sent to all it would be nice too see if they did, and a 3 & 10 second count down on the camera would be nice, and an option to select pics from your camera. hope my request comes true would give 5 stars for it :)",Rated 5 stars out of five stars,"December 12, 2022"
13,Thomas Shober,Just fun! It's nice to have such a simple social media app. it still feels a little young and could use more polish but I really love it. I've delt with small bugs that normally get fixed when you restart the app. I wish it would default to the last person you sent to rather than ALL. it'd also be nice to scroll within the widget through the photo history.,Rated 4 stars out of five stars,"October 12, 2022"
14,Particle,"App works initially, but it gets slow and spotty eventually. Reinstalling didn't fix it, restarted my phone, reset my connections, no luck. Generally unreliable app. Also, the Android version doesn't let you have multiple locket widgets for different people on your home screen, which was very disappointing. Wouldn't recommend it to anyone.",Rated 2 stars out of five stars,"January 16, 2023"
15,Nadia,"Locket is a great, fun, and creative app! Keeps you in touch with your friends without even having to say much! I'd suggest adding a feature to upload photos from your gallery to locket for higher quality photos as the in app camera isn't very good quality when it comes to certain android phones. Great app though and i can see so many more possibilities for it in the future!",Rated 4 stars out of five stars,"October 15, 2022"
16,SingYu Lam,"This has been a really fun app for me to use, however there are still a few things I'd like to see. Zooming in and reactions would be appreciated, but also more resizing options on the home screen. On my Pixel 5 I am unable to change the vertical height past a certain point, causing the widget to take up a lot of unnecessary space. Also, on iOS I was also able to export a video with all the lockets I have ever exchanged, but that feature doesn't seem to be available on Android yet.",Rated 4 stars out of five stars,"August 5, 2022"
17,Stylish Sylvie,"Great app, super fun! I love that we get to keep all the memories :) however, I think it'd be cool if you can have a widget for seperate friends because you can currently only have one widget up unless you want multiple of the same widget. Maybe you should make it to where you can have a widget for each friend, so like that friend's most recent photo. Also it would be cool if we could sent it to specific friends and have more than 10 friends. Thank you for your consideration, keep it up! :)",Rated 4 stars out of five stars,"April 22, 2022"
18,Camilleon241,"I feel like there are alot of improvements that you can make to the android version of this app, and I'll start from most needed to least needed. 1, better camera. The one now looks odd. 2, zooming in. I have no idea why zooming in isn't an option for the android version, it'd be very useful. 3, being able to send and receive reactions. I just found out the IOS version had reactions, and I've had this app for about 3 months now. These improvements can really make the Android version great.",Rated 3 stars out of five stars,"June 4, 2022"
19,Natalie Ray,"I love it but you can only have up to 10 friends, this wouldn't be a problem except the app won't let me have more than 5 while saying the max is 10 everytime I try to add new people. it also has a hard time registering who your friends are in the app when you first open it. you have to take 7+ pictures before it registers you have friends in the app. I do enjoy the recent update where you can send certain pictures to singular friends instead of all of them.",Rated 3 stars out of five stars,"May 26, 2022"
20,velsora,"It's a really cute app, I love it — except for the fact that when you have bad reception and it's loading to send a picture, you can't do anything — no retakes or cancelling — but to wait.... and sometimes it takes so long to send that it ends up not sending it at all :( so many fleeting moments lost and not sent entirely🥹 So yeah, make sure you have good internet connection when you want to send anything ever, or else just send a snap, I guess",Rated 2 stars out of five stars,"October 11, 2022"
21,Jordyn Taylor,"App is decent overall. I had a little trouble with it saying verification code is incorrect but it was a quick fix with just restarting the app and letting it automatically input it when the text was sent. My only complaint is that it doesn't have the option to send photos from your gallery or edit photos taken. Otherwise, I enjoy using the app to send pictures to my friends.",Rated 4 stars out of five stars,"April 22, 2022"
22,Baby Bans,"I love this app and definitely recommend it for relationships that are long distance. I do have to agree with a former review saying that we should be able to have multiple widgets with different photos/people, as that would literally make this the best app on my phone (I'm dead serious). But other than that no complaints.",Rated 4 stars out of five stars,"September 14, 2022"
23,Montanna,"Love this idea, it's so cute! Wish you could have multiple widgets on your home screen for different friends, though. I saw a screenshot demonstrating this, but it doesn't seem to work for me. I have two widgets on the home screen but both are showing the same photo. It would be nice to choose which friend is displayed in which widget. [EDIT: I really appreciate how quickly the developer team responded to this request! I'm looking forward to seeing how this app grows & happy to support you guys]",Rated 4 stars out of five stars,"August 8, 2022"
24,Cari Fisher,"I like it, but needs some work. For example, you should be able to add multiple widgets that show different photos. Right now two widgets just show the same pic. Also, the pics should have settings such as rotate or show newest only, so if you're missing photos you can change the setting. Maybe some way to see the reactions, and the main screen for the app shouldn't be the camera. The camera app needs lots of settings to compete. And different shaped widgets please!",Rated 3 stars out of five stars,"September 8, 2022"
25,Mike,"This app is awesome! For people like me, it makes me feel better and let's me know that my friends are still alive. Though I do really wish that you could upload pictures from your camera roll. That's probably my only complaint, because you cant send a cringy picture from when someone was little to embarrass anyone, and you cant send screenshots or anything. Other than that the app is amazing and I highly recommend, especially for people with anxiety!!",Rated 4 stars out of five stars,"May 23, 2022"
26,allison,"I dont really understand the low reviews. I've been waiting for the apps release on Android and I'm not disappointed. Although there are minor bugs, it's not anything too noticeable that it becomes annoying. I've been enjoying using it so far. Some suggestions for future additions, I would like to have the reaction feature added to android as well. I can receive reactions but I can't give them back. Can't wait for future updates.",Rated 5 stars out of five stars,"April 22, 2022"
27,Pann,"This is a great app to have fun with your friends. But please look after and give more love to the Android version, my ios friends can send messages to each other but i can't, also iPhone can take sharper and more resolution photos than my Samsung note 20U. Also, there are some bugs in the app, for example, I can't scroll down to the end of my emoji reactions list, and it keeps bringing me back to the top. Please fix the bugs, thank u!🙏💯",Rated 4 stars out of five stars,"March 15, 2023"
28,allyson gray,"It's a cute little app and it does its job okay, but the Android version is so limited compared to the iPhone version! It was really confusing because my friend on iPhone kept sending me ""replies"", but on my end I couldn't see them or respond in any way. I'd love to see a more complete Android version (I wouldn't even mind some kind of monetization feature to support development) - or at the very least a warning about the incompatibility of the different versions!",Rated 4 stars out of five stars,"March 2, 2023"
29,Shirley Lin,"Android version is actually terrible compared to iOS. My friends have been sending me text replies which i get the notifications for but am unable to see or respond to in any way. It also gets very laggy and sometimes glitches where I can see photos that others send but cannot send any back as when I take a picture the photo turns black and the screen freezes. I have had to delete and redownload a few times to fix it. Android still doesn't have the individual widgets option, which is unfair.",Rated 1 stars out of five stars,"March 6, 2023"
30,Pradipa,"This is nice for sharing memories with best friends. But the android version is soooooooo baddddd, how come you can reply in ios but not in android?? I don't want to reply my friends with SMS, and i occasionally get graphic issue whenever i wanna see my locket, while it is easily fixes by force closing, it IS annoyingly frequent. Thank you for letting us able to share memories this easy but your app is really bad in android please optimize it.",Rated 2 stars out of five stars,"March 18, 2023"
31,Jean Angulo (Jean Bean),"Great but I wish u could do more then just send people pics and add widgets to your home screen and it would be cool if you could use pics from your gallery. I also really don't like how really only IOS people get the ""special"" treatment it's not fair to samsung users. BUT it's a great app. People who are reading this should get this if you like to send pics to your friends.",Rated 3 stars out of five stars,"March 26, 2023"
32,James Kolea,"The app is great and cool! A few problems, the word count on the pictures is super short so I really can't type much at all, and as an andriod user I can't have the option to have certain people widgets so maybe that can be fixed and it glitches and the widget disappears sometimes. Otherwise a good app Not even close to as good as apple version which receives constant updates which is anoyying",Rated 1 stars out of five stars,"March 24, 2023"
33,Roeven Rajaine Balmes,"Been enjoying this app for quite some time now. But then last month the app started having some issues on my phone, doesn't send pics to my friends and only keeps on loading. Tried reinstalling it multiple times but then i encountered another issue on the verification code, again it doesn't send me any but only keeps loading",Rated 1 stars out of five stars,"March 19, 2023"
34,Vay,"Love the idea of the app, but the experience is terrible on android. The quality of photos is good to me but not to other people. The chat/reply feature is not available to all users, so my friends, who are Apple users, can reply to my photos, but I can't see it. We need better support for android.",Rated 2 stars out of five stars,"February 13, 2023"
35,xasb king,"The idea is great but the app experience is outdated and slow. I really wish that I use the app more than I do right now, so would you kindly make some changes. Make it faster, and fix the back button so it close the app, or make it possible to react to a photo from the widget.",Rated 3 stars out of five stars,"March 6, 2023"
36,silina,"1- I cannot send photos from the album, but on ios systems this is possible! 2- The feature of replying to the image is not available except through text messages, but in ios systems it is present! 3- The images are not saved or the ability to download them! 4- Annoying comment happens when emojis from friends are pouring in! I hope to fix these problems and pay more attention to the Android system, and I hope this will be resolved as soon as possible, because I am tired of waiting for an up!!",Rated 1 stars out of five stars,"March 9, 2023"
37,Abby Perlmutter,"I really like this app! I just wish it was the same as IOS. It's really annoying to not be able to see replies or send replies. Also I wish there was the video montage. Update: Now IOS just got a caption feature, but we still don't have any of the original features they have. Is there a reason? Please sync features with IOS and this app gets 5++ stars!",Rated 4 stars out of five stars,"March 22, 2023"
38,partfromgalaxy,"Hello everyone.I'm just curious about when I will be able to message people in Locket because I've been receiving a lot of Messages from my ios's users friends but when I want to check them in the app I don't even find a message button to click anddd when I want to send a message to a friend it will directly open the SMS?!,not mentioning the Image quality that changed when I send something or the lag in the app in general,like come on!android users use your app so please don't treat us like that",Rated 2 stars out of five stars,"March 16, 2023"
39,Tarun Sidharth,Good interface. Works as promised. Giving it 2 stars coz.. 1)it's super slow to open up on Android and buggy at times (ios version is better imo) and 2)it needs to have an option to send the occasional message within the app or via whatsapp.,Rated 2 stars out of five stars,"March 24, 2023"
40,Eurus Jade,I love this app so much but lately it hasn't been working for me. The app hangs when i take pictures and I also can't view the history anymore. I'm using redmi note 10 and I don't know if the issue is with my phone (since I've seen another redmi user complain about the same issue) but I hope you could fix this,Rated 2 stars out of five stars,"March 17, 2023"
41,Ramanpreet Kaur,"I sent pics to my friends but it takes forever to shoow it to her on its own. We have to manually open it a few times for it to refresh and then it shows the pic on home screen that was sent hours ago, it'd be great if it's more quick n refreshes the pics on it's own each time we open hone screen",Rated 2 stars out of five stars,"March 27, 2023"
42,Hazie A-F,It's a great way to communicate with friends and family but the app only seems to have more features towards iPhone users. I just recently noticed that my friends with iPhone can text and reply in app while they have to send me SMS messages just to reply.,Rated 3 stars out of five stars,"March 15, 2023"
43,Elizabeth Owles,Love the concept. It would be nice if there was a timer on the app so I can take photos from a distance. My boyfriend and I are long distance and love this app. Personally I don't really want filters or to upload photos because I think it takes away from the sentiment. I just would like the ability to use my Camera fully (timer or palm recognition for the Samsungs) etc,Rated 4 stars out of five stars,"January 12, 2023"
44,Sahasra Gadepalli,I love this app it's so easy to stay in contact with friends and also people that you don't see often or live further away! Just as suggestion: I would love for you to add a texting feature so to answer to the pics with text,Rated 5 stars out of five stars,"March 11, 2023"
45,Ray Bakugo,"The app is great and easy to use but it's really frustrating that I have a limit on how many friends I can have added. IOS has already been updated so now there's no limit for those with iPhones but people like me with Androids are still disadvantaged. This restrictiln struggles to make my experience with the app, positive.",Rated 3 stars out of five stars,"March 6, 2023"
46,Sakyawira,Really like the idea! The widget borders do not seem to respect the scaling convention other widgets on Android use though - makes it really ugly when side by side with other widgets. This and some performance issues render me unable to give you higher ratings. Please fix asap!,Rated 3 stars out of five stars,"March 4, 2023"
47,Christina Galdamez,"When I have it displayed on my phone screen, I can see what others send me. But when I try to send one back, my screen goes black and I can't send anything. Idk if it's cause we all have different phones or if my app isn't showing that it needs a new update.",Rated 2 stars out of five stars,"February 19, 2023"
48,Tamanna Tiwari,"Hey this is really great for us but i will like it more if there's an option gor lockscreen notification too. It's like the same now. If i have to unlock the phone yo check pics , i can send snaps or calls too. As snapchat id also provided the selected contacts home screen shortcut. Can u plzz upgrade this for lock screen too??",Rated 3 stars out of five stars,"March 30, 2023"
49,Ting Rui Na,"the high auto-brightness when entering the app on an android is extremely annoying, causing me to not use it as much as possible because it's very very glaring. the loading is very slow and androids as well. also, there doesn't seem to be a page to find all the reactions u have gotten other than these, the rest seem to be working fine, which is great",Rated 2 stars out of five stars,"December 18, 2022"
50,Benjamin Micheli,Overall great performance great for me and my friends. However I have a few thing that would make it just that bit better: 1. Streaks - Everyday you should send 1 photo at least to each other to keep a streak. 2. I'd really like to be able to have a different widget for different people instead of one widget for all. 3. The UI feels really big and in your face but other than that really cool. Hope my suggestions can make a difference.,Rated 4 stars out of five stars,"December 29, 2022"
51,Sushanth Kamath,"There has to be a way for the dev team to bring some form of feature parity with iPhones. The Android app is just doing the bare minimum and has an odd bugs where you can't exit the app by hitting the back button and has to be done with the home button. Also, I wish there were other widget shapes to choose from - like the ones google photos has.",Rated 3 stars out of five stars,"November 4, 2022"
52,Alan Gaev,"The application is really good, but its implementation on android is simply disgusting compared to ios. Users still cannot communicate within the application with each other when ios users can chat between themselves. Also, the scroll is incredibly twitchy and laggy, and it's far from the technical characteristics of the device. It remains to be hoped that the implementation of Locket on android will become better over time, but I don't think it will happen .·⁠´⁠¯⁠`⁠(⁠>⁠▂⁠<⁠)⁠´⁠¯⁠`⁠·⁠.",Rated 2 stars out of five stars,"February 14, 2023"
53,Chestnut1895,"The captioning system is phenomenally terrible. The character limit is enragingly small, and you would think that you bloody be able to see what you're typing as you type, but that accommodation isn't made either. Otherwise, it is a very appealingly cute app. I'm giving it two stars because other than the pictures, the captions are what are supposed to give this app its intended signature feel. An unrelated suggestion: accommodate automatic saving of pictures into the gallery.",Rated 2 stars out of five stars,"October 25, 2022"
54,Celina Josephine,i actually really like this app but it is very sad that the ios version is constantly getting new features while the android users have to wait a lot of time if we even get the features. hope this might change in future.,Rated 3 stars out of five stars,"March 28, 2023"
