,names,reviews,ratings,date
579,nana,the app is amazing but sometime it doesn't update any new photos so its quite upsetting i hope you can fix it :) thank youu,Rated 4 stars out of five stars,"January 27, 2023"
580,Reisha Gadrinab,"this is a great app; however it'd be great if android users had the same features as apple users (e.g., seeing message replies)",Rated 3 stars out of five stars,"January 24, 2023"
581,Syirah,I know how to play now cause my friend keep asking me to update a picture but one thing I don't like about this app cause when you put it at the home screen the pictures is small I want to make the picture big but I don't know how.,Rated 5 stars out of five stars,"November 17, 2022"
582,renata,"i can't use the app, it keeps saying ""cant send code"" so i can't log in to the app. ughh",Rated 1 stars out of five stars,"December 22, 2022"
583,Phạm Nguyễn Khánh Hưng,I can't even log in to the app. When I first downloaded and insert my phone number it didn't send me any code to log in to my account.,Rated 1 stars out of five stars,"December 1, 2022"
584,Kawther Alsaffar,"i use honor 20pro and i have like 4 back cameras and one of them is micro camera. when i open the app to take a picture by the back camera it appears so foggy and not clear because it uses the micro camera, and i don't have the option to switch between the cameras so i can take good pictures. please, i need this issue to be fixed as soon as possible because it's very annoying and I'm considering deleting the app.",Rated 3 stars out of five stars,"September 17, 2022"
585,lvel dreess levl dreess,I can finally login from my android device!! I really enjoyed this app and I'm having alot of fun~ the only downside about the android version is: - no reactions/messages - the camera screen overlaps with the pictures sometimes -take long time to load previous pictures -camra quality is very sad overall worth it and I'm looking forward for the new updates~♡,Rated 3 stars out of five stars,"May 16, 2022"
586,Brianna Knapp,"I'm sorry I'm only giving it one star but it's just not working it doesn't send the verification code. I saw all the good reviews, barely any complaints and the locket team actually responding and saying that there fixing things. It's just not working though, I put in my number then I wait and the verification code doesn't come.",Rated 1 stars out of five stars,"August 25, 2022"
587,Brendon Griffith,I think the app would deserve a 5 stars if we had an option to use filters or send pictures from our phone gallery/camera roll,Rated 4 stars out of five stars,"October 29, 2022"
588,Afnan Alharbi,"I can't register to it... It gives me this message every time I try to... [auth/too-many-requests] [Edit] Now when i try to register i have another problem... It gives me this message.. [Couldn't send code] Make sure your device has good cell reception. We could also be experiencing high demand right now, so check back later and try again. ! So what should I do now? If the problem isn't resolved i will Uninstall it...",Rated 1 stars out of five stars,"April 26, 2022"
589,Moaz Lbabide,Quality of photos are really baddd and you can't send normal messages,Rated 1 stars out of five stars,"March 2, 2023"
590,Deven Samuel,"I gave 4 stars, i hope locket serve filter to the users. overall i like it alot, keep moving forward!!",Rated 4 stars out of five stars,"October 31, 2022"
591,Xela Ji,I don't know if its just mine or its beacuse I use android but I dont have the chat thing and I can't see my friends reply to my lockets,Rated 3 stars out of five stars,"February 28, 2023"
592,Natasha,"This app is easy to use and has potential to gain more users. My suggestions are, perhaps the dev team could let the user add their own emojis. Next, letting user add caption to their picture and able to comment on others picture. One more thing is maybe notification? I hope these suggestions can be taken into considerations. Keep up the good work 🙌🏽",Rated 4 stars out of five stars,"June 13, 2022"
593,Minh Son Nguyen,I CANT RECEIVE THE VERIFICATION CODE. DELETED THE APP AND DOWNLOADED IT AGAIN OVER AND OVER BUT THERE IS STILL NO CODE,Rated 1 stars out of five stars,"March 2, 2023"
594,Liberty Sanders,Love this app. It's a great way to send and connect with friends and family but if u have more than one person on there and u want to send a photo to ONE of the people you can't. IT sends to EVERYONE you have. It drives u crazy,Rated 4 stars out of five stars,"April 19, 2022"
595,medenii,"it's a great widget app, although I do wish to get more updates on it like adding a feature to change your name, and have different photos on each widget instead of just one, but overall it's pretty good :)",Rated 4 stars out of five stars,"August 19, 2022"
596,Akhmad Agaev,"Why the hell did y'all add a watermark to exported photos? You guys aren't doing anything to the photo to have the right to place a watermark on it, the app doesn't edit it, doesn't alter it, so why you're putting the watermark on a photo you have no contribution to?",Rated 3 stars out of five stars,"August 29, 2022"
597,Miljan Trajković,App is great but having a larger group of friends is an issues because widget only shows the last send picture. Would be great if u could see multiple pictures and swipe between them on the widget.,Rated 3 stars out of five stars,"October 6, 2022"
598,Makgotso Khumalo,"this is app is great for keeping up with friends. Better than BeReal. Easy interface, just a bit slow sometimes. It's also easy to add contacts to the app",Rated 3 stars out of five stars,"August 15, 2022"
599,Ainsley,Love the idea but i hate that you have to use phone numbers and texting to become friends with people. I have friends that live in another country so i can't text them to add them without major cost. This is a huge flaw imo,Rated 3 stars out of five stars,"June 10, 2022"
600,Obera死,wouldnbe great of the pictures would not be stuck with the previous picture rather than the recent one,Rated 2 stars out of five stars,"February 1, 2023"
601,Jamin L,"great app so far, until today. really weird bug where the app will go super dark, lowering my phone's brightness. as soon as i close the app, my phone's brightness goes back to normal. get a pop-up saying ""can't adjust the brightness as this app controls the brightness"" or sething to that effect. whilst using locket. was wondering if this was a common thing or just a me problem?",Rated 4 stars out of five stars,"August 8, 2022"
602,Raven Ching,"A very pleasant app for connecting with my partner in long distance relationship. Just one problem here: instead of getting app notifications when my partner reacts to my photos, I m getting SMS containing the reaction, i.e. the emoji !! Why is it happening and how can I stop it? Will it incur additional charges? Looking forward to your reply, cheers",Rated 4 stars out of five stars,"August 17, 2022"
603,Osanix _,"It worked perfectly for the first day but now it just keeps crashing when I click on the app, can't open it anymore which is really disappointing as it just keeps going to a black screen and then kicking off the app.",Rated 2 stars out of five stars,"April 23, 2022"
604,Noa Karaso,It's great way to connect with friends in a funner way and i love this app i really recommend it,Rated 5 stars out of five stars,"January 16, 2023"
605,Anto Eche,Very confusing but good idea I guess,Rated 1 stars out of five stars,"February 21, 2023"
606,Koo Ooo,Why I can't send a messages like my friends !! Pls solve this problem,Rated 1 stars out of five stars,"March 8, 2023"
607,Jaredmarc Machado,"Can u guys add the option tonjust post from album or have a filter thingy, its quite fun to have tbh keep ur friends updated and stuff but yeah just a suggestion",Rated 3 stars out of five stars,"December 16, 2022"
608,sa_zxy8,"It's very good, but there are a lot of things that iPhone has and Android doesn't, like writing or drawing on the photo before sending it, I hope Android can have features like iPhone without waiting too long",Rated 3 stars out of five stars,"September 18, 2022"
609,Tori L,"Really cool and fun, I really wish you could have a different widget for each friend though. If you have 2 friends send photos around the same time there's a high chance you miss seeing some of them",Rated 3 stars out of five stars,"June 2, 2022"
610,Sasha Coley,I like the concept what I don't like is it seems like I can't have widgets for each of my friends it's just one widget and so it makes it to where it's not as enjoyable as iPhone people. If there was an update to where I could have multiple widgets with different friends for each of those widgets the same way iPhone users do I would totally love it.,Rated 2 stars out of five stars,"August 6, 2022"
611,Elye,"personally, this app needs some work. I would love to be able to have more than ten friends and you can't react to what people send me. you can't send pictures to a specific person, which bugs me. I would love to see some improvements.",Rated 3 stars out of five stars,"April 20, 2022"
612,Zairil Saldaña,It's good but my friend is messaging me and I can't see the message (my friend is using iphone and i'm using android),Rated 4 stars out of five stars,"January 18, 2023"
613,b612,App is fun to use for friends but has such consistent buggs. Everytime i try to open it up it tells me to add friends in locket even though I already do. I have to exit the app and open it again a minimum of 5 times every time before it allows me to take a picture,Rated 2 stars out of five stars,"May 20, 2022"
614,Triz (Trizbot),"This app is great for groups of friends. Very simple; easy to use. Does its job well. However, there's an issue. If you're using an android phone, you can't write OR read captions on posts. This really sucks.",Rated 3 stars out of five stars,"September 21, 2022"
615,Zion Banks,I hate it .I don't even know how to take a picture on it because it just shows this slide that are just showing live photos of ppl,Rated 1 stars out of five stars,"December 17, 2022"
616,Daniel Čus,"don't know of this is just my expirience but i find this app really badly optimized for android... in comparison for ios it visibly runs much slower. On android it's just unresponsive, and everything takes so much time... besides that, i find the idea behind the app interesting and with potential",Rated 2 stars out of five stars,"September 7, 2022"
617,Mallory Conaway,It would be amazing if it didn't ask me to add friends constantly. It's annoying.,Rated 3 stars out of five stars,"January 2, 2023"
618,Sumi Chan,I love it but in Samsung version ther is no massage feature 😕 So I wish that you update it quickly as soon as possible,Rated 3 stars out of five stars,"January 12, 2023"
619,Zërø,"Google play gets updates late, so i can't see what my friends with iphones say. Very annoying",Rated 2 stars out of five stars,"February 9, 2023"
620,Jasson Balbuena,the app is really good but it would be better if you can take photos in the gallaray or sent from soc med and put it here on locket,Rated 4 stars out of five stars,"January 24, 2023"
621,Doody m,The app is refusing to let me login.. It keep saying that my cell reception isn't good.. Which is not.. I need help🙂💔,Rated 1 stars out of five stars,"January 8, 2023"
622,Soban Rafiq,Terrible experience. Tried many time but couldn't able to log in. App not working,Rated 1 stars out of five stars,"January 11, 2023"
623,Areej,"The images are blurry and there is a clear negligence in the Android locket, while there are many features for the iOS locket",Rated 2 stars out of five stars,"January 28, 2023"
624,Mia maldonado,"It's fun but y'all need to add the iOS update to Android too ,android version is so behind",Rated 4 stars out of five stars,"January 21, 2023"
625,Noor,"Its so good and one of my fave apps for sure but there's a problem that i see updates on another locket not on main , as android user the text update not on my locket yet",Rated 1 stars out of five stars,"January 23, 2023"
626,Smoky joosh,PLEASE gwt rid of the auto brightness override on android. extremely annoying and makes it unusable,Rated 2 stars out of five stars,"January 28, 2023"
627,Erika Selene,"this app is literally the best app i ever had, you can share photos to your friends, family or even a bf/gf i recommend this app",Rated 5 stars out of five stars,"January 2, 2023"
628,Ivy Olesi,Jus wish we had filters.....and why does it take up a lot of data....coz maybe I want fo use the app some place with no wifi.....good app to catch your cheating boyfriends 😌😌,Rated 2 stars out of five stars,"January 30, 2023"
629,Liza Lauren,"Idgas about how cool this app is, but it has a bug for adroid which couldn't send verify code message. This is stupidly annoying.",Rated 1 stars out of five stars,"January 31, 2023"
630,Abubaker Downloading gmail,such a convenient app that allows fast chatting between friends and relatives,Rated 5 stars out of five stars,"January 28, 2023"
631,Mariana Henderson,Great app one thing tho is I wish they would add a way to put separate people as wigits not all,Rated 5 stars out of five stars,"January 12, 2023"
632,Princess Kriza Leigh Maximo,I like it but when i restarted my phone the app kept glitching hopefully u can fix this,Rated 3 stars out of five stars,"February 5, 2023"
633,Chean Navalta,"please add to input more texts, its clearly not enough despite that its all good and fun",Rated 5 stars out of five stars,"January 9, 2023"
634,Kwarto,"When am I gonna see the ""reply into your locket"" feature like the android app doesn't even show it, only the reactions Hopefully the update would be soon",Rated 3 stars out of five stars,"January 8, 2023"
635,Chisomaga Obike,I don't know if its only my phone but I can't seen to send messages but it's a cute app,Rated 3 stars out of five stars,"January 27, 2023"
636,Francis Bustinera,Please update it same with apple users like.. we can specify widgets to a specific person and some other settings,Rated 3 stars out of five stars,"January 17, 2023"
637,iman irdina,it is cute and all but please make replies available for android!!! i wanna talk to my friends here too,Rated 3 stars out of five stars,"February 8, 2023"
638,zahra raisya,"im stuck in verify number after i download this again, at first the new update content of my friends didnt show up in mine",Rated 3 stars out of five stars,"January 29, 2023"
639,Furo Jeshua,Hello locket managers please the app is good no cap but on android its not really productive because of the rate at how slow it takes to open and some features that are cool on ios are not on android please help us thank you,Rated 5 stars out of five stars,"January 31, 2023"
640,4-viowb Y,why do i need to add friend to use it like i want to use it personally without anyone involved in my business this so annoying i deleted it one minute after i download it,Rated 1 stars out of five stars,"January 6, 2023"
641,waffle enthusiast,Now the chat feature is missing for me i do not know why but everytime i press the chat button it takes me to my messenger app instead of the app's,Rated 4 stars out of five stars,"February 5, 2023"
642,Qisya Adelia,I can't add the widget to my home screen it shows the tutorial for apple only,Rated 2 stars out of five stars,"January 6, 2023"
643,Maram,أتمنى أن يتم تحديثه بسرعه لم تضيفوا لنا خاصية التعليق على اللوكيتات للأصدقاء I hope it will be updated quickly you didn't add us the feature of commenting on the friends,Rated 3 stars out of five stars,"January 5, 2023"
644,RPM Channel,"I love that I can connect with my friends and crush, but pls utilize the same ui as ios for android.",Rated 4 stars out of five stars,"February 9, 2023"
645,Chien,I was wondering why can't I reply my friends photos but they can reply mine? Hope it can be fixed.,Rated 3 stars out of five stars,"January 9, 2023"
646,kkk,I can't send Messages to my friends on locket why? My phone is android and even I can't get the messages that my friends sends to me,Rated 2 stars out of five stars,"January 29, 2023"
647,Rio,"i like this app! but can you please make log in with phone number optional because it's a little bit dangerous and not good, you can add log in with email. or you can add an option so we can add people with a code instead of their phone number",Rated 3 stars out of five stars,"May 3, 2022"
648,Donny Garcia,Like the app but I'm confused as to why the ios version has the best friend feature where you can have multiple widgets for seperate ppl but not android. Hopefully that can be added soon cause that would make the app 10 times better.,Rated 3 stars out of five stars,"September 19, 2022"
649,Sam Lee,"I'm currently using a Samsung , and all I'd say is that it does me and my photos NO JUSTICE . It's been almost 2 months since my friends and family already got their ""retry if there's no internet option"" , but here I am much later , and till haven't gotten that update on mine . Much disappointed , plus the updates reach non-apple users much later , would be appreciated much more if this issue is solved asap <3",Rated 2 stars out of five stars,"September 23, 2022"
650,Julianne Palaypayon,"This is a really good app for sharing pics with your friends but, for some reason my camera doesn't work in app. I mean it can take photos but the camera is just a black screen. It's quite hard to take a photo since i can't see what im taking a photo of at all :(. Pls tell me how to fix this.",Rated 3 stars out of five stars,"August 18, 2022"
651,Ikeshia Grace,"want to register but its always said cant send code, too many attempts. could be a great app",Rated 2 stars out of five stars,"December 27, 2022"
652,Themi Megas,Opens to a black screen but widget still works. Can't send images,Rated 3 stars out of five stars,"December 25, 2022"
653,Tayeb,"Can't send messages in response to locket images while ios users can send messages to me, I can't even reply.",Rated 2 stars out of five stars,"December 19, 2022"
654,Yahya Ahmed,I can't even sign up. Says too many attempts on signing up with phone number,Rated 2 stars out of five stars,"January 5, 2023"
655,Maria Vasquez,"I would love the option to send a reaction, download/save pictures and the ability to zoom in. Also I noticed that the pictures sometimes do not update until refresh or enter thd app.",Rated 2 stars out of five stars,"May 28, 2022"
656,Vaiwilmalua Maotua,It's a nice and simple app. Just that we can't send more than a one line sentence and it would also be nice if we could send videos or even photos we took earlier or before,Rated 3 stars out of five stars,"October 8, 2022"
657,kero king,It's really cute and fun! Easy to use too!! My only nitpick would be the fact that I'd like to send some kind of drawing function like on iOS but that's really all! Still a really cutesy app!,Rated 4 stars out of five stars,"April 18, 2022"
658,Laurine Bonion,It would be nice if we could also send separate photos on Android just like on the iPhone. Plus the flash thing on the front cam and the reaction. I hope you can add this feature on android for the next update!,Rated 4 stars out of five stars,"April 20, 2022"
659,Aaman Khan,Great so far just the flash issue when taking photos in the dark the front screen doesn't allow flash (obviously not a real flash but the bright white screen) and rear camera pictures appear white as the picture is taken when flash is over camera so please fit that other than those 2 issues it's great!,Rated 4 stars out of five stars,"April 16, 2022"
660,Joey N.,i wish the pictures would automatically save on your phone,Rated 4 stars out of five stars,"March 9, 2023"
661,Swfs MMM,"I love this app so much, but please update android version like ios version",Rated 4 stars out of five stars,"March 3, 2023"
662,Chaera Abancio,Fun and can use this to update your loveones.,Rated 4 stars out of five stars,"March 11, 2023"
663,جوري الغامدي,Can you please put the You button in Samsung devices I will be appreciated and happy,Rated 3 stars out of five stars,"March 6, 2023"
664,Chelsea knauf,"it's amazing, definitely a worth while app",Rated 5 stars out of five stars,"March 3, 2023"
665,Io I7,"Hi loket it is a great app but in android we can't send Without wifi but ios can do that?? It is a very cool application, but it lacks this feature. Thank you for adding the writing on the pictures. It is a very nice option",Rated 4 stars out of five stars,"September 27, 2022"
666,الزعيم,Thank you very much for this great update 🙏🏻♥️🌹.....I'm very happy🥳...Now I can choose what emoji I want to send as a reaction😍❤️‍🔥❤️‍🔥❤️‍🔥....Many thanks to the developers behind this update🙏🏻🌹....Rating has been raised to 5 stars👍🏻⭐️,Rated 5 stars out of five stars,"November 13, 2022"
667,Yousef Negm,"i love this app but i'm very upset by the lack of options on android, the IOS version can send reactions and time travel... also the flash option for taking pictures doesn't work right, the snapshot timing is wayy off",Rated 3 stars out of five stars,"June 4, 2022"
668,L,The app is simple and cute but I think it would be a lot better if we can add caption to the image. Oh. And please add the features to add from ur camera gallery. It would be MUCH MUCH better,Rated 4 stars out of five stars,"June 1, 2022"
669,Mai-Ly Tran,Love using this to keep up with friends/family across the country. Wish the Android version was more up to date with the iOS options though - I want to be able to have separate locket widgets for different people for example,Rated 4 stars out of five stars,"October 20, 2022"
670,Kenzie,"the app is amazing !!. i used it not long ago but i deleted it because my friends deleted it and i don't need it anymore. i downloaded it again for a friend of mine, but when i added my number it didn't send me the code, i tried twice and still didn't get any codes. so please fix this problem as soon as possible.",Rated 3 stars out of five stars,"August 22, 2022"
671,Wedyan Alhail,"I had it on my ipad for a few weeks then when i found out its on android i immediatly logged out and insttaled it here. When i go in the app, i put my number in and the code message will never send me a code to put it in the app. I've had tgis problem for less than a month and i would like it to be fixed. But all and all, the app is really fun to use.",Rated 2 stars out of five stars,"May 29, 2022"
672,Cynthia kerinja,Don't get me wrong I love the app But the android version is depressing compare to ios,Rated 1 stars out of five stars,"February 24, 2023"
673,Erica Nelson,"Not ready for Android! Can't even finish signing up. It asks for my name in set up, I hit continue and it just sounds. It never loads past that. I've force quit, cleared app cache, even reinstalled.",Rated 1 stars out of five stars,"April 19, 2022"
674,Amanda B.,"Fun app to share snaps with your unexpecting family and friends, give them impressions of your day.",Rated 5 stars out of five stars,"February 20, 2023"
675,Ainur Sarafina,the camera doesn't work. it's just showing black screen but it was fine at first. i already uninstall and reinstall it but it still the same. please fix this issue edit: it works! just sign out and sign in again and now the camera's working,Rated 1 stars out of five stars,"August 14, 2022"
676,Dmitry Stepanov,"a little emoji pack. and even if somebody from iOs sends other emoji that isnt default from android, so it will not appear",Rated 2 stars out of five stars,"October 23, 2022"
677,Nur Aziza,it will be nice if android can chat like on iPhone '),Rated 4 stars out of five stars,"March 24, 2023"
678,Tea Yonzaga (Tea),"app does not let me sign up despite me typing in my correct number. it takes an entire day for the code to be sent, and when it does send, it doesn't work wjen typed into the app. when contacting staff about the problem, they were not helpful at all. please do better.",Rated 1 stars out of five stars,"April 28, 2022"
679,Louise Ahimsa,"Hello! I'm not sure if it applies to all devices, particularly android users, but when i use the back camera on locket, it turns blurry. Although my back camera is operates smoothly on my camera app, i just don't know why whenever i use this app, all my pics that are captured through the back camera came out blurry. Please help!",Rated 3 stars out of five stars,"July 26, 2022"
680,Juan Carlos Corona Romero,"Slow in opening to the camera to capture the right moment. Most of the time I stare at a black screen on startup, then I have to switch camera modes and by that time the moment is lost.",Rated 3 stars out of five stars,"September 22, 2022"
681,시몬Qilah,"It's so cute to share our moment with our friends and family. But i hope you can add notification, add reaction more, add filter, and add profile picture too. So that can be more awesome and cool for this app. Thank you <3",Rated 5 stars out of five stars,"November 11, 2022"
682,Michael Echim,"The idea behind this app is awesome. However, it does not work at all. I send friend requests to my friend and she accepts it, but it doesn't show that to me. When I resend the request, she has two identical accepted requests and it doesn't show me that she accepted it",Rated 1 stars out of five stars,"April 19, 2022"
683,mento zed,The app is great and works very good on Android. The only thing that the app lacks is the feature to upload photos from gallery and even edit them other than that it's still nice.,Rated 5 stars out of five stars,"April 22, 2022"
684,Bentley Brown,It's so fun and cute to have on my homescreen,Rated 5 stars out of five stars,"February 28, 2023"
685,Alyssa Palma,I love sending pictures to my friends.And it's a bonus that the pictures send even with almost no wifi!,Rated 5 stars out of five stars,"December 18, 2022"
