,names,reviews,ratings,date
1428,amina,amazing but PLEASEEEEEE make an option where we can delete a photo for everyone istg the amounts of times I accidentally sent embarrassing photos to multiple people is insane 💀💀,Rated 4 stars out of five stars,"August 9, 2022"
1429,Lama Ayoub,I can't zoom in even in the back camera and it is huge turn down for me I'm a Huawei user and the zoom feature doesn't even exist,Rated 1 stars out of five stars,"June 4, 2022"
1430,Wyatt Ellingson,"Used to be pretty good, now it's breaking all the time, not showing pictures in history or just not letting me send pictures",Rated 3 stars out of five stars,"June 25, 2022"
1431,Bart Bak,"Works great, i just wish i could add a photo to the widget that's already in my gallery.",Rated 3 stars out of five stars,"June 17, 2022"
1432,Hanin Izzati,Nice concept! I love it! Would be nice if we could respond to our friends' photos though!,Rated 5 stars out of five stars,"May 9, 2022"
1433,Aimee Solomons,So so awesome. I wish it had the option to take videos or create movable images.,Rated 5 stars out of five stars,"July 18, 2022"
1434,Nicole Mangoba,It took so long to load right after I put my number in it. I have been waiting for so long but its still not going through! Please fix it :((,Rated 1 stars out of five stars,"September 29, 2022"
1435,DrBlacker,"Hueta ebanaya. Sometimes app just doesn't load and interface is so stupid and single-celled, so I have no clue, how can I view my profile",Rated 1 stars out of five stars,"July 28, 2022"
1436,Hassan Ahmed,The app still not working even after the update. Every time I try my number in it's respond is that I've entered too many requests!!!,Rated 1 stars out of five stars,"April 23, 2022"
1437,Zeal Zaniest,"I can't have a chat function with my friends, can you solve this",Rated 3 stars out of five stars,"January 5, 2023"
1438,Shahad Al-Marzouqi,I really like this app however it lags a lot and when I want to see my older photos it lags everytime I scroll.,Rated 4 stars out of five stars,"August 13, 2022"
1439,Melody Loretto,"It's a really good app, just for some reason everytime I go on it now, my brightness goes really really low I could barley see anything. 😭",Rated 3 stars out of five stars,"August 21, 2022"
1440,Janet Manansala,"Not really for android 🥲. This app even though i reached 10 min of ppl i add i can't continue, like why can't just skip that adding person??!",Rated 3 stars out of five stars,"April 19, 2022"
1441,Diana Liz,"Overall great app, I'd just wish there was away to only send an image to one person instead of everyone you added",Rated 5 stars out of five stars,"April 26, 2022"
1442,Theseus Undead,"It doesn't work if you live in a different country than the person you're trying to send it to, my bf and I are long distance, I love in the US and he lives in the UK, it didn't even work🙄🥲",Rated 1 stars out of five stars,"April 24, 2022"
1443,Alyssa Goebert,How to know who I sent the pics to is confusing,Rated 4 stars out of five stars,"February 23, 2023"
1444,Thazza Mae Santiago,I just downloaded the app. Its been loading FOREVER our WiFi is stable and it's still loading. :(,Rated 4 stars out of five stars,"April 28, 2022"
1445,Serenity Esquivel,I wish it would let me put different widgets for different people,Rated 3 stars out of five stars,"January 2, 2023"
1446,Jada “Grey” J,It's actually pretty cool,Rated 4 stars out of five stars,"March 11, 2023"
1447,Deda Amr,"Too bad, because I have to add people from the contact and dealing with him is difficult, and I cannot take a picture from the photo gallery",Rated 1 stars out of five stars,"December 26, 2022"
1448,friendly neighbourhood idiot,"The app barley works, and I cant get past the screen where it asks me to verify my number because it never sends a message.",Rated 1 stars out of five stars,"June 30, 2022"
1449,Jaden,"pretty good and easy to use, definitely could do updates for Android so it would be better.",Rated 3 stars out of five stars,"April 19, 2022"
1450,SnickerDoodleBamBoozle,It's fun but needs to be able to add more friends than 10. But it is nice to send photos to my friends.,Rated 5 stars out of five stars,"September 4, 2022"
1451,Kira 3001,"Hooray, finally it works! 🎉 I'm very happy with app, only one wish, make reaction like on IOS, and it will be solid 5 stars! Thank you for your efforts😌",Rated 4 stars out of five stars,"May 23, 2022"
1452,Farissa Hashfa,"it was fine at first, then it started crashing 2 days ago, till now. i cant even open the app",Rated 2 stars out of five stars,"April 24, 2022"
1453,Wolf In sheeps clothing,I cant sign up every time I do there has to be a little message about why I can't sign up either I sent to many times or smt about auth/to many requests,Rated 2 stars out of five stars,"May 3, 2022"
1454,gabie,"I couldn't even get into the app. It kept saying ""something went wrong and unavailable"". That is all it said.",Rated 1 stars out of five stars,"April 27, 2022"
1455,Toka Abu zeineh,"For me it is a great application, but I hope that adding friends will be an infinite number and Thanks.",Rated 4 stars out of five stars,"August 16, 2022"
1456,Ally Wai,Replacing people in locket is becoming my biggest fear. Also the app keeps asking me to add friends but i already have 10 friends? Like i can see my history too but i just cant send lockets,Rated 3 stars out of five stars,"May 14, 2022"
1457,Abj Nada,"The contact is the problem, not all people like to share their numbers with u and not all contacts have this app too :((",Rated 3 stars out of five stars,"May 3, 2022"
1458,Kïmï Sawidi,this app is amazing but why can't i open the replied chat ?,Rated 3 stars out of five stars,"January 10, 2023"
1459,Willa Culp,I love the app and the concept tho it does get annoying when ios gets new features and updates frequently as android just got reactions.,Rated 4 stars out of five stars,"June 8, 2022"
1460,Alaa Shbat,It's not working I try to sign in with my phone number but I don't understand the problem so I can fix it all I see alot of messy words,Rated 3 stars out of five stars,"April 20, 2022"
1461,Jonelle Bishop,It's very hard for me to add friends everytime I do it it tells me that I need to add friends I wouldn't recommend this app,Rated 1 stars out of five stars,"April 22, 2022"
1462,Angel Ariogun,"I no longer see the snaps I send...I see what my friends send but I can't see what I send, fix this issue immediately",Rated 2 stars out of five stars,"October 7, 2022"
1463,Cristina Gonzalez,Is anyone else having problems with taking a photo?it won't let me,Rated 3 stars out of five stars,"November 28, 2022"
1464,Adam,I can't send comment to my friend 😔,Rated 2 stars out of five stars,"March 29, 2023"
1465,WAN AQMAR HAKIMI BIN WAN KAMARUZAMAN,"because I cannot reply to others, not like iPhone",Rated 3 stars out of five stars,"January 17, 2023"
1466,Maegan Johnson,I don't like this app because you need to put in a code from text if you have a Motorola e phone like me you know how annoying it is when you do this and you forget you need a phone card to call or text so annoying,Rated 1 stars out of five stars,"June 3, 2022"
1467,Paul Blauensteiner,"Very funny but you could add something like filters, text and photos with like a 10sec timer",Rated 4 stars out of five stars,"July 19, 2022"
1468,Tochukwu “Adrian” Ikeaba,"Great app, but after the update on android, opening the app reduces my brightness so low I can't see anything.",Rated 2 stars out of five stars,"August 12, 2022"
1469,Daniel Jackson,"Good idea, wish we could select who we send to as well as send photos from our gallery as well.",Rated 3 stars out of five stars,"April 20, 2022"
1470,11.ปัณวรรธน์บดี เกตตะพันธุ์,Some function can't use on android,Rated 4 stars out of five stars,"January 17, 2023"
1471,Daryl Dejumo,"please fix the issues regarding black screen, I have installed and uninstalled several times, yet it is still on blackscreen",Rated 1 stars out of five stars,"April 23, 2022"
1472,Tundra,Can u make comments or chat features for android user?-?,Rated 4 stars out of five stars,"February 15, 2023"
1473,Ahmad Alrumaih,"Device is Blocked I have tried to register for this app, but it fails every time, and show this message Auth/too-many-rquests",Rated 1 stars out of five stars,"April 19, 2022"
1474,salma .m.x,the camera is not working in this app even though i allowed the camera access ability but it still doesn't work and i can't add friends back,Rated 1 stars out of five stars,"May 7, 2022"
1475,Катя Нездоровина,"Good app. But I don't understand why I have the lowest brightness in the app. I even can't change it, cause there's no ""settings"" button. Please, tell me how to fix it",Rated 4 stars out of five stars,"September 5, 2022"
1476,Courtney Louw,"Good app, but i think we should be able to add a longer message and more reactions.",Rated 4 stars out of five stars,"October 1, 2022"
1477,Roya Sulaimani,I have been waiting for this app to lunch on Android for so long but everytime i enter my phone number i don't receive the code and i tried a lot 💔,Rated 1 stars out of five stars,"April 23, 2022"
1478,sayoNARAMI,"The app is really cool, but it would be more cool if there's a filter. Really great appp",Rated 5 stars out of five stars,"April 19, 2022"
1479,Rin Kagamine,Can we get the update same as the apple version? :(,Rated 3 stars out of five stars,"January 10, 2023"
1480,Monica Varona,It's cute but i hope we can use it offline,Rated 2 stars out of five stars,"November 20, 2022"
1481,Matías Moglia,"I could use some widget customization features (sizes, edges, transparency, etc.)",Rated 4 stars out of five stars,"August 31, 2022"
1482,Мария Захарченко,"after I enter my last name and first name, the application does not work further. there is an endless download, so one star",Rated 1 stars out of five stars,"April 19, 2022"
1483,Karnaca,"it's not working not with me nor my friends, when i try to sign up it says ""too many requests, you have been blocked""",Rated 1 stars out of five stars,"April 19, 2022"
1484,Hala Alayde,"I really like the app but I don't have the option to write on the photo or emojies or sth , I hope it get this update very soon 🙏",Rated 4 stars out of five stars,"September 19, 2022"
1485,muneera purr,It's so good app but we need (you) section,Rated 4 stars out of five stars,"November 21, 2022"
1486,zuqp m,"Hi Locket, why didn't I receive the code to log in?",Rated 5 stars out of five stars,"December 31, 2022"
1487,Amani,I have download it for the first time and it says we have blocked all requests from this device due to unusual activity!!!!,Rated 1 stars out of five stars,"April 22, 2022"
1488,Fatyma C.,no problems i just kinda wished that there was also a way to upload other pictures that were already taken ｡◕‿◕｡,Rated 4 stars out of five stars,"June 26, 2022"
1489,Michanna K,Really fun to use with friends. Love seeing their pictures throughout the day!,Rated 5 stars out of five stars,"June 13, 2022"
1490,•chey•,its a fun app and im glad its on android but if i want to send a photo it goes to all my friends i would like to only send it to one or pick and choose,Rated 3 stars out of five stars,"April 21, 2022"
1491,Kuro,When i wan to signe up i get notifications Couldn't send code even though everything is fine The app is not ready and a waste of time and storage 👎🏻,Rated 1 stars out of five stars,"April 24, 2022"
1492,M,Okay the problem is the Android ver don't get any update as the iPhone and that pretty much annoying.,Rated 2 stars out of five stars,"June 12, 2022"
1493,natasha,A little laggy for androids and I wish you could add friends without a phone number maybe an email or something but it's cute :),Rated 4 stars out of five stars,"May 2, 2022"
1494,T AAA,"The app was good, until I noticed I can't see who sent the picture. It's Just write Loading.",Rated 3 stars out of five stars,"June 3, 2022"
1495,Iliyana Iskandar,I cannot send pictures individually to my friends. I can only send to every single one of them. Please fix this 🙏🙏,Rated 3 stars out of five stars,"April 19, 2022"
1496,Hayley Mumbi,"Why don't we, android users, get the same updates as the iPhone users do??🙄",Rated 1 stars out of five stars,"December 31, 2022"
1497,Aws,Not functioning well i couldn't put my phone number once I try to it says too many attempts even though I only tried once.,Rated 1 stars out of five stars,"May 9, 2022"
1498,starspeakz,"Does not open at all, please fix it and don't rush. Us android users can wait.",Rated 1 stars out of five stars,"May 24, 2022"
1499,Riya Paul,It's like little snapchat and Instagram with widgets feature.,Rated 3 stars out of five stars,"March 8, 2023"
1500,Aaliyah Osa-iduma,this app is so good and exactly what they say it is and it sure is funny🤣🤣 honestly the people who created this app are geniuses,Rated 5 stars out of five stars,"November 30, 2022"
1501,ruby C,the app didn't work even tho i delet it from my ipad. now i got new problem they can't send a code they need to fix it asap,Rated 1 stars out of five stars,"April 23, 2022"
1502,Debby Alfred,I like it just wish it had funny filters,Rated 5 stars out of five stars,"October 23, 2022"
1503,Fudgie Fajilan,"pretty great to use, especially with your bff's",Rated 5 stars out of five stars,"November 12, 2022"
1504,personally idk anymore ;-;,really fun and works well but it'd be better if you could send photos from your gallery as well,Rated 4 stars out of five stars,"June 11, 2022"
1505,Assyl Bakytov,"I simply CAN'T add my phone number. It DOESN'T accept 0, therefore I CAN'T SIGN UP. PLEASE fix this asap. thank you!",Rated 1 stars out of five stars,"April 19, 2022"
1506,Calfa Magdalen,"I feel like android experience is delayed way too much, my iOS friends are 1 to 2 updates ahead of the Android version",Rated 3 stars out of five stars,"October 9, 2022"
1507,Mohammed,When i want to login it doesn't let me to get in. It says that i have tired so many time but i didn't tired so much i only tired two times only. Please fix that,Rated 1 stars out of five stars,"April 20, 2022"
1508,Meow,This app is bad as hell I mean I was trying for a week to open this app and he still tell me he couldn't send the code to my device I did everything but still nothing happened,Rated 1 stars out of five stars,"April 29, 2022"
1509,Denji.,i don't have the message feature,Rated 3 stars out of five stars,"February 11, 2023"
1510,Noah Leigh,"3 star, i added my number in it took way to long for it to load i cant even open the app its just stuck in the loading screen fix this please my internet is good 👍",Rated 3 stars out of five stars,"April 19, 2022"
1511,Po ol,can't set it up. it always shows couldn't send code.,Rated 1 stars out of five stars,"December 24, 2022"
1512,Soph T,Fun and nice to see my friends pics! Could hv more emoji stuff and things to decorate our pics with!,Rated 4 stars out of five stars,"October 9, 2022"
1513,James Olaseeni Aina,This app sucks and it's very slow heavy on Android which is very annoying.,Rated 1 stars out of five stars,"November 22, 2022"
1514,El,Its great but I think you should let a picture to be deleted permanently not only personal but on other people's app too,Rated 3 stars out of five stars,"October 16, 2022"
1515,Kyla G.,android phones are alright and working. but verifying ios phone numbers in ios don't work.,Rated 4 stars out of five stars,"October 16, 2022"
1516,khy,i really love this app but it would be great if we can delete our picture for everyone too.,Rated 4 stars out of five stars,"October 15, 2022"
1517,Mason Tong,I can't read any of the replies I get until I go to the app on my iPad. Add replies to android as well please!,Rated 3 stars out of five stars,"December 24, 2022"
1518,fauros,"Nice app to connect with friend. Idk why it sets the brightness at max when it's opened tho, really annoying",Rated 4 stars out of five stars,"October 16, 2022"
1519,nisaa azmi,it's good but there's no profile/username shown like the apples version and the reaction emoji is very limited,Rated 3 stars out of five stars,"October 17, 2022"
1520,Cloudy Cloud,When I downloaded and went to verify my phone number the verification took over 20 minutes and didn't even end up verify.,Rated 1 stars out of five stars,"October 22, 2022"
1521,Kayden Break,"MY FRIEND SUGGESTS TO INSTALL THIS AND I THOUGHT WOW WHAT A NICE IDEA! SO FAR NOTHING'S WRONG, I OPEN IT, PUT MY NUMBER AND THEN WHAT? THE LOADING TOOK FOREVER? I'M DONE, PLEASE FIX THIS",Rated 1 stars out of five stars,"December 4, 2022"
1522,Isabelle Sanders-Clarke,I love this app legit sooo much it makes me and my friends closer and I also look good in all the pictures lmao,Rated 5 stars out of five stars,"October 5, 2022"
1523,I dont even know:,really good w sending and taking the pic but lags a lil I would live if we could have more than 20 friends,Rated 4 stars out of five stars,"October 11, 2022"
1524,"CRISOSTOMO, YVON FAITH S.","i accidentally signed out my locket acc and i cant log in again because my mobile number is already expired, is there a way to log in even without the code? really want my locket account back :( i emailed the locket help regarding this but there's still no response.",Rated 5 stars out of five stars,"October 9, 2022"
1525,Queen,It doesn't update at the same time ios does☹,Rated 3 stars out of five stars,"January 4, 2023"
1526,J,"It doesn't accept my phone number i don't know why, everytime say try later. I was waiting for long time please fix this problem.",Rated 2 stars out of five stars,"April 18, 2022"
1527,Kendrick Lucas,"My camera is not working, it's just showing a black screen. I can't send any pictures to my friends",Rated 1 stars out of five stars,"May 5, 2022"
1528,star,"I love the idea behind this app, however after adding only 6 friends (the limit is 10), they said i reached the friend request limit...?",Rated 3 stars out of five stars,"May 10, 2022"
1529,Azwa Aida,It's really helpful to keep my lover update my daily pictures . Love it .,Rated 5 stars out of five stars,"November 2, 2022"
1530,Abdullah Al-Ghamdi,"It doesn't work. I can't even set it up saying that they blocked my phone for ""suspicious activities"" looolll",Rated 1 stars out of five stars,"April 21, 2022"
1531,jayy,Very nice app but I hope you could pick existing photos from your gallery instead of taking a photo.,Rated 4 stars out of five stars,"April 19, 2022"
1532,ريري ال مدني,Weee neeeeed update for Android device 😐,Rated 1 stars out of five stars,"March 31, 2023"
1533,_ AZZOOME _,"It's a good app, but i can't view reactions or make them. If you fix that the it's definitely a 5 star app. <3",Rated 4 stars out of five stars,"May 11, 2022"
1534,Nur Safiah,its useful for ldr couples who busy but they want their partner to know what they doing. it would more fun if they let us draw or put texts on the pictures,Rated 5 stars out of five stars,"June 20, 2022"
1535,chivalryishere,"Doesn't work for Samsung anymore. I launch the app, and all I see is a black screen.",Rated 1 stars out of five stars,"July 25, 2022"
1536,Maricris Casiro,"next time add some notification when someone is sending a pic so they will know they sent one, but over all the app is great",Rated 5 stars out of five stars,"April 23, 2022"
1537,Yara,"For Android, No messages!! 👎🏻",Rated 1 stars out of five stars,"January 26, 2023"
1538,dei,Loading takes too long and max brightness always tries to blind me at night. Please turn it off.,Rated 3 stars out of five stars,"September 29, 2022"
1539,Ayeesha Hammed,need to be fixed ...not working properly on android devices,Rated 2 stars out of five stars,"March 29, 2023"
1540,Elliott Family,"Love it, hate how we can't text each other thru the app tho",Rated 4 stars out of five stars,"January 10, 2023"
1541,Mariam Amil,When i try to register it says too many request and my device have been blocked. Please fix this issue.,Rated 1 stars out of five stars,"April 20, 2022"
1542,Thanh Mai,"Really want to see ""comments"" on Android version, pleaseeeeeeeee",Rated 3 stars out of five stars,"March 28, 2023"
1543,Nourhan Mohamed,Love the app but can you please add the delete picture from everyone and can you add to send a picture from phone it would be so much better,Rated 5 stars out of five stars,"August 12, 2022"
1544,L A (PINK FOOTBALL SING GIRL),Doesn't let you select certain people to send pictures. Just sends them to all,Rated 3 stars out of five stars,"April 12, 2022"
1545,SeriouslyNotLucia,I think this is a really good app and I am now InTouch with my friends but I wish you can add text too,Rated 4 stars out of five stars,"August 19, 2022"
1546,Ona. M,i just wish you didnt have to have the person number to be able to become friends with them and share pictures on the app,Rated 4 stars out of five stars,"June 16, 2022"
1547,GEO,It's better if i can comment to their photo,Rated 3 stars out of five stars,"January 17, 2023"
1548,Moneera Saleh,I am unable to sign up! :/ I'm facing error too many requests even though I tried once to log my phone number,Rated 1 stars out of five stars,"April 20, 2022"
1549,zoey blossom,It ruined my camera quality and I can't use back camera it's blurry(no my camera not dirty it's from the app) Pls can u do something about it I really want to enjoy the app with my friends<3 -thank you,Rated 2 stars out of five stars,"May 1, 2022"
1550,Aleksandr Kolodchenko,When you make possible chats in locket like on iPhones ? Very need this permission,Rated 1 stars out of five stars,"December 22, 2022"
1551,Hadassah Nwakamma,I can't access my messages maybe is because is an android 😪,Rated 4 stars out of five stars,"February 16, 2023"
1552,Rhessa Morata,"I can't finish setting up, it keeps saying there is ""something wrong"" even though I've entered the correct code.",Rated 1 stars out of five stars,"July 7, 2022"
1553,Franz Anthony Martin Dy,This is not android friendly :(,Rated 2 stars out of five stars,"January 13, 2023"
1554,Lance Olpindo,"When I open the app it doesn't let me take a pic at all, the screen doesn't even load.",Rated 2 stars out of five stars,"April 19, 2022"
1555,Umar Bunu,"You deserve no stars, because you all disregarded androids. Only concentrating on IOS. I mean ""if snapchat and whatsapp does it, why can't we"" right? It disgusts me.",Rated 1 stars out of five stars,"January 19, 2023"
1556,cheska bagos,"I can't take a photo, I don't know if its because my phone is android 11 or what but my friends can still send me a photo of them but i can't. (Sorry for wrong grammars)",Rated 2 stars out of five stars,"June 11, 2022"
1557,Arlyn Sanchez,My verification code is correct but they say it is not correct,Rated 1 stars out of five stars,"November 9, 2022"
1558,Sanie,This app ao good but i want the update!!!!!☹️☹️,Rated 5 stars out of five stars,"January 2, 2023"
1559,Zinus Kent (Mooshroom),I couldn't even get into the app to use it because it kept saying that my CORRECT verification codes were wrong,Rated 1 stars out of five stars,"June 16, 2022"
1560,Xi Everest,"I love the idea but I wish I could react to my friends photos etc, also I wish I could select from my gallery and such.",Rated 3 stars out of five stars,"August 19, 2022"
1561,Chinwendu,"it's a good app, it serves it's purpose but my issues with it are: the flash and the lag when opening it.",Rated 3 stars out of five stars,"May 6, 2022"
1562,Raeystarafi Dzakhwan,"when i tried to log in, my number can't get the code bruh",Rated 1 stars out of five stars,"January 7, 2023"
1563,Wasayf Pervez,why does android get new features soooo late?,Rated 3 stars out of five stars,"December 29, 2022"
1564,Macy Katt Lapasaran,I can't even use the app...sorry but the text code that the app said isn't working...i haven't received any for hours now..😩,Rated 1 stars out of five stars,"May 28, 2022"
1565,mortein,The flash needs a rework it captures the part that its finding the focus. Front flash should be a must too,Rated 3 stars out of five stars,"April 20, 2022"
1566,soraya fathullah,"Its great n amazing, so fun. But how do i apply multiple widget for dif people? When i put 2 widget the same pic appear :/",Rated 4 stars out of five stars,"October 2, 2022"
1567,Justine Chappel,Such a cute app it's a fun way to communicate and it's also super fun I highly recommend this app it's personally my favourite app 10 out of 10,Rated 5 stars out of five stars,"June 30, 2022"
1568,AB,"The app just blocked my phone cause there was ""too many requests"" I was just trying to create an account.",Rated 1 stars out of five stars,"April 19, 2022"
1569,Tyrah Montinola,"Please help me po. My rear cam ON THIS APP is always blurry even though there is nothing on my rear cam and even though when I open other apps that uses the rear cam, it's not blurry at all unlike this app :')",Rated 4 stars out of five stars,"June 8, 2022"
1570,Natsu,"great app. maybe fix the camera thing, it's just black unless u take a photo.",Rated 3 stars out of five stars,"July 25, 2022"
1571,Rodainah Belal,I haven't received any recent updates on the app,Rated 2 stars out of five stars,"December 31, 2022"
1572,نواف الذبياني,The app doesn't work when the mobile language is arabic you have to change the language to English to work solve this problem,Rated 1 stars out of five stars,"May 10, 2022"
1573,Hamalamadingdang,cant upload pics from gallery,Rated 1 stars out of five stars,"January 7, 2023"
1574,Mohammed Alahmad,Unfortunately I never had the chance to test the app as I never was able to get phone number confirmation code!,Rated 1 stars out of five stars,"April 26, 2022"
