,names,reviews,ratings,date
2485,دانه القريني,Nice app and very easy to used 👌,Rated 5 stars out of five stars,"May 29, 2022"
2486,Zahraa Mohammed,Why i can't puplish a photo unless i have a friend this is so noisy and i don't like it,Rated 1 stars out of five stars,"July 30, 2022"
2487,rayyanah karasnah,The app didn't work on my phone and I don't the reason,Rated 1 stars out of five stars,"April 19, 2022"
2488,Benjie E.,"please make time travel for android too, this isn't fair!!!",Rated 3 stars out of five stars,"August 18, 2022"
2489,Sand,not really made for android users since you can only make seperate locket widges on iphone,Rated 1 stars out of five stars,"September 20, 2022"
2490,Deisy Lopes,do it to put a photo from the gallery and not just take a picture 👉👈😢,Rated 4 stars out of five stars,"August 31, 2022"
2491,Richard Salinas,I'm so excited to use this with my friends and happy it came to android,Rated 5 stars out of five stars,"April 18, 2022"
2492,MOHANAD ALSHEHRI,just opened the app and put my number and blocked me for no reason!!,Rated 1 stars out of five stars,"April 20, 2022"
2493,Mel Jacob Calusor Calara,"It didnt send me the code, ive been waiting for so long",Rated 3 stars out of five stars,"May 6, 2022"
2494,hyun1n7,please allow android users to edit our display name and profile too.,Rated 3 stars out of five stars,"September 22, 2022"
2495,Emily Winkel,I cant even get it to send me a code. All my friends love it but it won't send a code,Rated 2 stars out of five stars,"May 12, 2022"
2496,winston churchill,could you improve the camera quality,Rated 3 stars out of five stars,"July 30, 2022"
2497,Farah Feda,It is not working Plz fix it,Rated 1 stars out of five stars,"April 21, 2022"
2498,MALEK AMJED,i cant use the app becuse i have a bug,Rated 1 stars out of five stars,"April 29, 2022"
2499,TGZ assassin,I can't change my username but besides that I like the app,Rated 3 stars out of five stars,"August 19, 2022"
2500,Kyle De Leon,Camera isn't working. I'm using infinix.,Rated 1 stars out of five stars,"April 28, 2022"
2501,عبدالمجيد الحربي,It doesn't sent the code says too many attempt,Rated 1 stars out of five stars,"May 5, 2022"
2502,Dylan Ramsden,Only works for one day then never opens again,Rated 1 stars out of five stars,"June 28, 2022"
2503,Angelé Hatdog,When will it plan to text me the message?😣 What's not clicking babe?,Rated 2 stars out of five stars,"May 10, 2022"
2504,Wolfeathers,I absolutely love this game *Sends pic of myself during class*,Rated 5 stars out of five stars,"September 30, 2022"
2505,Mire Nazire,locket is running very slow on android,Rated 2 stars out of five stars,"June 6, 2022"
2506,P.ahmed r,Can't even use it because the app blocked me for no reason,Rated 1 stars out of five stars,"April 20, 2022"
2507,Ayesha Ayra,"pls add reactions and let us choose who all we want our pics to be sent to, thanks !",Rated 3 stars out of five stars,"April 22, 2022"
2508,احمد,Hello thanks for releasing it on Android! <3,Rated 5 stars out of five stars,"April 18, 2022"
2509,dalia Army77,he can't send me the code when I put my number ' can't they make it like the ios!,Rated 1 stars out of five stars,"May 5, 2022"
2510,Nelly celest,Wish you could add photos from camera roll,Rated 4 stars out of five stars,"May 19, 2022"
2511,Lubna javaid,I played this at my funeral and it was amazing thank you!,Rated 5 stars out of five stars,"April 24, 2022"
2512,Mohd Alsaig,I can't do focus for the photo,Rated 1 stars out of five stars,"July 26, 2022"
2513,Ruwaida Najm,Adding the reaction ability to the Android version would be appreciated,Rated 3 stars out of five stars,"May 24, 2022"
2514,janu yamasushi,i wish i could make seperate lockets like on the apple version :(,Rated 2 stars out of five stars,"September 24, 2022"
2515,TheLucky FourLeaf,Verification code doesn't work,Rated 1 stars out of five stars,"May 19, 2022"
2516,Monica Louise Nacionales,"Add more functions to android, cowards.",Rated 3 stars out of five stars,"June 5, 2022"
2517,Ibrahim Taha,It's good but there is a problem on the camera,Rated 3 stars out of five stars,"June 13, 2022"
2518,Emily Haynes,The thing that I wish you could do is draw or write on the photos,Rated 5 stars out of five stars,"April 24, 2022"
2519,Jojo Felemban,Still can't get an account because i am not receiving any verifying code 💔💔,Rated 1 stars out of five stars,"June 18, 2022"
2520,Uyên Phương Cao Nguyễn,i didn't receive otp anymore to log in this app,Rated 2 stars out of five stars,"February 5, 2023"
2521,kimmy,camera isnt working,Rated 1 stars out of five stars,"April 27, 2022"
2522,Dana,updates for androids are too late :(,Rated 4 stars out of five stars,"October 4, 2022"
2523,Eyhesia Atienza,I find it cute but the problem is.. I don't have friends to do this with. I have a friend. But she doesn't want to.,Rated 5 stars out of five stars,"April 21, 2022"
2524,Lorrane Rivera,It's a good app 🤙🏼,Rated 5 stars out of five stars,"November 3, 2022"
2525,StephanWnt,UI needs work,Rated 4 stars out of five stars,"September 8, 2022"
2526,Nenoo,Solve the problem of not sending the message code,Rated 5 stars out of five stars,"April 25, 2022"
2527,Just Khalid,"When I wrote my phone number they say ""Too many attempts. Please try again later."" And I can't login what should i do ??",Rated 1 stars out of five stars,"May 1, 2022"
2528,Patrino Williams,It's good and you should download it because Yes,Rated 5 stars out of five stars,"October 8, 2022"
2529,HADES,I am getting bugs ew kinda bugs.,Rated 1 stars out of five stars,"December 1, 2022"
2530,edits fancy,I've been waiting for this one i hope it will be worth the wait love the app ❤️,Rated 5 stars out of five stars,"April 18, 2022"
2531,Precious Jucel Malveda,its good just no zoom in 👹,Rated 4 stars out of five stars,"May 25, 2022"
2532,Natalie,You need to update it with messages for android users!,Rated 3 stars out of five stars,"March 1, 2023"
2533,Suha Almohammadi,Can't sign up. Won't send the code.,Rated 1 stars out of five stars,"May 10, 2022"
2534,diadjenghumairoh,"i cant use my camera, they're black screen, but my bf can took a picture, hiskm😖",Rated 2 stars out of five stars,"April 18, 2022"
2535,halizah hqq,it's cute lol I can share lovely pic with my lovely ppl,Rated 5 stars out of five stars,"October 16, 2022"
2536,Seneca Hughes,I don't know why but it won't let me write a message it doesn't say add a message???,Rated 3 stars out of five stars,"September 12, 2022"
2537,Precious Aboloye,its a good app,Rated 4 stars out of five stars,"November 11, 2022"
2538,Nana Yaa Frimpong,"best way to communicate w my friends,love it",Rated 5 stars out of five stars,"March 5, 2023"
2539,Abigail Anthony,Cute but I can't get in to the app,Rated 1 stars out of five stars,"October 13, 2022"
2540,Tien Minh,cannot receive code 😀,Rated 1 stars out of five stars,"January 25, 2023"
2541,Riane Marinie Gaon,flash not working for front cam,Rated 4 stars out of five stars,"April 18, 2022"
2542,STEM N,unsend feature where,Rated 1 stars out of five stars,"October 27, 2022"
2543,Cockatiel Studios,"Not as good as the iOS version, basically just a shittier Snapchat",Rated 1 stars out of five stars,"August 21, 2022"
2544,Devie Marrey De Guzman,Verification code not working,Rated 1 stars out of five stars,"April 20, 2022"
2545,Amateur,>SMS number verification won't send >No other option for SMS verification,Rated 1 stars out of five stars,"April 19, 2022"
2546,nicho paule,wahhh so convenient,Rated 5 stars out of five stars,"November 20, 2022"
2547,Erin Smith,It is saying I have to add friends before taking a photo why,Rated 1 stars out of five stars,"April 20, 2022"
2548,Oats,Y do androids get such late updates,Rated 1 stars out of five stars,"January 22, 2023"
2549,stephanie chanel,i think u should add replies and allow us to write smthing n the photos,Rated 3 stars out of five stars,"August 29, 2022"
2550,لمياء خالد,in samsung Ican't send maseg😭😭😭 pleees,Rated 1 stars out of five stars,"December 14, 2022"
2551,tony mcdonough,It won't send my code to mt phone,Rated 1 stars out of five stars,"February 5, 2023"
2552,Asma,It's so good app,Rated 5 stars out of five stars,"October 16, 2022"
2553,Shinny Diamond_sparkles,"It has bug, not good",Rated 1 stars out of five stars,"April 20, 2022"
2554,Batata Louka 7,How do I add a friend?? Me and my friend can't do that.,Rated 2 stars out of five stars,"September 17, 2022"
2555,fatma Said,The camera isn't working,Rated 1 stars out of five stars,"April 19, 2022"
2556,Saffiya Maisarah,I've been waiting for it and yes I love it even though I don't really have friends,Rated 5 stars out of five stars,"April 18, 2022"
2557,Duncan M,Can't send pictures separately 👎,Rated 1 stars out of five stars,"April 20, 2022"
2558,Askar N,"Can't register, because registration form won't let me type 0 in my phone number",Rated 1 stars out of five stars,"April 19, 2022"
2559,no exo no life,The camera does not work for me in this application and I do not know why,Rated 1 stars out of five stars,"May 20, 2022"
2560,이연주,funny app. love it!,Rated 5 stars out of five stars,"September 7, 2022"
2561,Thảo Nguyễn Phương,Pls do the version like ip for android,Rated 1 stars out of five stars,"February 26, 2023"
2562,nnappt,Well... I can't zoom in. Why?????????,Rated 3 stars out of five stars,"July 24, 2022"
2563,Mohamad Ibrahem,Code sending problem,Rated 1 stars out of five stars,"December 22, 2022"
2564,Sama Ma'moun,The camera isn't working,Rated 1 stars out of five stars,"May 14, 2022"
2565,Sade Belle,Easy app to use.,Rated 5 stars out of five stars,"October 12, 2022"
2566,D B,Verification doesn't work.,Rated 1 stars out of five stars,"August 21, 2022"
2567,gacha._. anime,I have good internet but it would not verify the code that it texted me,Rated 1 stars out of five stars,"April 22, 2022"
2568,Calista Pangaribuan,I love it so much,Rated 5 stars out of five stars,"January 17, 2023"
2569,Reem Alshehhi,I'like it so much (•ө•)♡,Rated 5 stars out of five stars,"February 20, 2023"
2570,Mo A,We are too late than ios users 👎🏼👎🏼,Rated 1 stars out of five stars,"February 12, 2023"
2571,Ahru Kim,the camera doesn't work on my Tecno Spark 6 phone,Rated 1 stars out of five stars,"April 19, 2022"
2572,Amoni Dixon,is a cool app,Rated 5 stars out of five stars,"January 21, 2023"
2573,Ma. Salvina Fatima G. Rodriguez,love it<33,Rated 5 stars out of five stars,"January 14, 2023"
2574,Cerenity Will,love it.so does my family,Rated 5 stars out of five stars,"January 15, 2023"
2575,fatimah,My ios friends keep sending to me replies but i can't see it,Rated 1 stars out of five stars,"February 28, 2023"
2576,Jana Almugbil,"Nice app, a little laggy tho.",Rated 4 stars out of five stars,"June 8, 2022"
2577,Heba Obaid,"Doesn't seem to let me sign up just says "" too many attempts""",Rated 1 stars out of five stars,"May 4, 2022"
2578,Kathlyn Ader,Too slow and laggy,Rated 1 stars out of five stars,"April 21, 2022"
2579,Maddyson Lane,its great app,Rated 5 stars out of five stars,"October 29, 2022"
2580,A Google user,Omg you don't need to pay for nothing and you can be safe with this app,Rated 5 stars out of five stars,"November 1, 2022"
2581,Wej,App not working on s22 ultra,Rated 1 stars out of five stars,"April 28, 2022"
2582,Khurt Ubando,Can you update i just got installed it but the camera doesnt work,Rated 3 stars out of five stars,"April 22, 2022"
2583,sadida 152,Can't zoom but still good,Rated 4 stars out of five stars,"June 19, 2022"
2584,Emilee Fontenot,It sucks you can only use it if you have friends 😐 and I don't have thos,Rated 1 stars out of five stars,"April 21, 2022"
2585,i hieo,Its not work for android,Rated 1 stars out of five stars,"May 3, 2022"
2586,Zhoumei,"I accidentally signed up an account on my android phone with my new phone number. Can you at least put delete account button for android, please.",Rated 5 stars out of five stars,"September 16, 2022"
2587,Angel Acosta,Good but it's very buggy,Rated 3 stars out of five stars,"May 18, 2022"
2588,Jerome De Vega,I like it!,Rated 5 stars out of five stars,"November 19, 2022"
2589,水晶,I really like this app but sometime it's kinda lack 😕,Rated 4 stars out of five stars,"July 17, 2022"
2590,Veronica Cortes,it was okay,Rated 4 stars out of five stars,"March 12, 2023"
2591,Germaine Pastores,ugh!!! it so mabagal magsend ng code!!!,Rated 1 stars out of five stars,"November 19, 2022"
2592,Ermuun Bayanbat,"not complicated noice app, i think",Rated 5 stars out of five stars,"June 6, 2022"
2593,Duckz,add an option to put a caption on photos you send 🙏🙏,Rated 4 stars out of five stars,"May 24, 2022"
2594,Sukaynah Al Mowail,There is no zoom and there is ERROR,Rated 2 stars out of five stars,"June 12, 2022"
2595,ekj.76,it doesn't work!!,Rated 1 stars out of five stars,"May 8, 2022"
2596,Alister Blanco,The camera didn't work it's a shame,Rated 1 stars out of five stars,"May 22, 2022"
2597,Yara _okl,i cant write anything on my pic i cant even comment + i want to open my profile but It doesn't appear 💀💀,Rated 4 stars out of five stars,"September 20, 2022"
2598,Da karastikkk,Absolute trash because it needs phone number,Rated 1 stars out of five stars,"September 16, 2022"
2599,ريان الشلوي,I don't receive the code so that I can start using the app,Rated 1 stars out of five stars,"December 26, 2022"
2600,Kloudia klodie,The app is not working!,Rated 1 stars out of five stars,"April 21, 2022"
2601,Priscilla Goodness-Amao,Good I wish I could delete my photos tho,Rated 4 stars out of five stars,"April 18, 2022"
2602,joseph chua,it doesn't work this is awfull,Rated 1 stars out of five stars,"April 19, 2022"
2603,Mobile Legend,it's good yeah,Rated 5 stars out of five stars,"January 22, 2023"
2604,Jasper Lloyd Nipales,Maybe add some options that can make you add caption on the photo,Rated 3 stars out of five stars,"May 1, 2022"
2605,Marianne Girard,Love this app but I don't have friends,Rated 2 stars out of five stars,"March 1, 2023"
2606,lvjx 0.0.,Its not work with Android I can't sing in,Rated 1 stars out of five stars,"April 19, 2022"
2607,Rowena Baricuatro,would be nice to have a gallery option,Rated 4 stars out of five stars,"May 13, 2022"
2608,Sora Argelo,A fun widget to send candid photos to your close friends,Rated 5 stars out of five stars,"August 25, 2022"
2609,FAISAL KAABI,I add my number but app doesn't work,Rated 1 stars out of five stars,"May 1, 2022"
2610,Matrix x,Lovely idea I just wish there were more reaction options,Rated 4 stars out of five stars,"July 13, 2022"
2611,Kit Kat,I Didn't get the three digit code from you,Rated 1 stars out of five stars,"November 14, 2022"
2612,Azri Hussein,please update it to make it less lagging,Rated 5 stars out of five stars,"June 15, 2022"
2613,Wilco Olivier,its the best,Rated 5 stars out of five stars,"February 15, 2023"
2614,brayden Cowles,this stuff Is ballin,Rated 5 stars out of five stars,"February 20, 2023"
2615,Lix Ju,When the comments will be there?,Rated 3 stars out of five stars,"February 23, 2023"
2616,lalsgoor __,We need comments section in Android,Rated 2 stars out of five stars,"February 19, 2023"
2617,John Secret,I cannot even add it as a widget,Rated 1 stars out of five stars,"April 20, 2022"
2618,Greys Q,needs more work 🥲 my cam doesn't even let me take pics even tho i have friends na,Rated 1 stars out of five stars,"April 27, 2022"
2619,Antony Robert,Kinda hard to add people,Rated 3 stars out of five stars,"September 9, 2022"
2620,anlyna ali mohamed,great app no problems with it,Rated 5 stars out of five stars,"June 8, 2022"
2621,maureen,"not doing justice to us android users, only the ios(iphones) get the nice updates and what not... androids are neglected",Rated 3 stars out of five stars,"November 7, 2022"
2622,Majeda Sibai,Not working on Samsung whyyy?,Rated 1 stars out of five stars,"August 20, 2022"
2623,Sara Butler,Omg this stuff good as a mother trucker,Rated 5 stars out of five stars,"March 15, 2023"
2624,Arif Raihan,Can't write comment or even see what my friend's commenting on my photo from iOS,Rated 1 stars out of five stars,"March 8, 2023"
2625,Corey Walker,limited user experience for Android users compared to iPhone users,Rated 3 stars out of five stars,"March 6, 2023"
2626,Veronika Martemianova,Always has bugs,Rated 2 stars out of five stars,"March 30, 2023"
2627,Carter Xyzzz,I have the same complain as every other android user,Rated 1 stars out of five stars,"March 29, 2023"
2628,Bri Bri,Does not work on Obama Care phone,Rated 1 stars out of five stars,"March 19, 2023"
2629,Shantanu Rawat,It's not working..... 👎👎,Rated 1 stars out of five stars,"March 28, 2023"
2630,Phoenyx Vines,I love it bc i van take a picture and send it to all the 8 people i have on there,Rated 5 stars out of five stars,"May 7, 2022"
2631,lana Alasmr,"The program is nice, but I am not satisfied with it. I don't know why",Rated 2 stars out of five stars,"April 29, 2022"
2632,Zareefah Alisha,My history isnt loading,Rated 3 stars out of five stars,"October 23, 2022"
2633,CrazyGurlMari,It's great to share with friends and family,Rated 4 stars out of five stars,"October 16, 2022"
2634,Catherine Garchitorena,"U can't select or choose a photo, I can't send a meme to my friend",Rated 4 stars out of five stars,"October 21, 2022"
2635,Lucas Marshall,Pretty good safe and free to use i would recommend for sure,Rated 5 stars out of five stars,"September 14, 2022"
2636,aaliyah Yambo,I get to blow up my sisters phone with this app I LOVE IT,Rated 5 stars out of five stars,"October 19, 2022"
2637,Rose Alghamdi (Fooz),التطبيق لايعمل على الاندرويد... İ can't useit at android,Rated 1 stars out of five stars,"May 6, 2022"
2638,Adedolapo Egbeolowo,it makes sense like mad,Rated 5 stars out of five stars,"December 29, 2022"
2639,Fabian Getugi,Better than Snapchat ngl!!!😂😂,Rated 5 stars out of five stars,"November 25, 2022"
2640,Aimi Sofea,cant see reactions,Rated 1 stars out of five stars,"October 24, 2022"
2641,Mark Pazdniakou,Doesn't show reactions,Rated 1 stars out of five stars,"November 10, 2022"
2642,Dominic Espalmado,I didn't not get the code,Rated 1 stars out of five stars,"November 30, 2022"
2643,Morgan White,I have too many privileges.,Rated 5 stars out of five stars,"November 5, 2022"
2644,Thami Chantel,I love it.,Rated 5 stars out of five stars,"November 6, 2022"
2645,cyrus jigs y. zablan,LMAOOO I LOVE IT,Rated 5 stars out of five stars,"October 30, 2022"
2646,Rickie,Better than the others,Rated 5 stars out of five stars,"December 29, 2022"
2647,Alliane Gatpayat,Better than I expected!,Rated 5 stars out of five stars,"October 25, 2022"
2648,Norah Alwabel,VERY LATE UPDATES,Rated 1 stars out of five stars,"January 1, 2023"
2649,King Savage,lmaoo its sum fun😜😜,Rated 5 stars out of five stars,"October 31, 2022"
2650,Salem Alshammri,The verification code doesn't arrive,Rated 1 stars out of five stars,"February 18, 2023"
2651,Ayiiko,I can't take a picture because my locket camera blank 😞 (i already give it a permission),Rated 4 stars out of five stars,"May 3, 2022"
2652,Mahmoud Y.,Still not ready for Android it won't even let me register,Rated 1 stars out of five stars,"April 19, 2022"
2653,whiz del,"I can't log in, can't get digit code",Rated 2 stars out of five stars,"February 28, 2023"
2654,Abdullah Jamal,It finally works.. good fun app,Rated 4 stars out of five stars,"May 12, 2022"
2655,Remi Kakuzatou,I don't receive verification code Everytime.,Rated 1 stars out of five stars,"May 17, 2022"
2656,ebozic,The app is pretty nice and fun to use.,Rated 5 stars out of five stars,"July 18, 2022"
2657,Gamingmc,Hey sissy i wanna tell u that why i havent got my code yet like ive been waiting for minutes and it still give me their codes and i properly did my numbers correct and i dont know what to do pls help me its so frustrating to see my friend having fun 😩😩 ty! Help me out of misery pls,Rated 2 stars out of five stars,"April 22, 2022"
2658,Debra Adhibrata,ITS SO CUTE AND FUN,Rated 5 stars out of five stars,"October 24, 2022"
2659,Roneth Olaivar,very nice and simple,Rated 5 stars out of five stars,"August 24, 2022"
2660,Onoca,Doesn't send confirmation message,Rated 1 stars out of five stars,"May 25, 2022"
2661,Megan Herdson,this is a super sweet app and cheers me up x,Rated 5 stars out of five stars,"August 19, 2022"
2662,Lheimer,me and my cousin love it it's a great app,Rated 5 stars out of five stars,"October 21, 2022"
2663,Leen Meshnouk,it's not working on my device,Rated 1 stars out of five stars,"April 22, 2022"
2664,Joshua Saruca,I like how the features from iOS are being added!,Rated 4 stars out of five stars,"June 14, 2022"
2665,Aqilah,should give the option to share pictures from gallery,Rated 2 stars out of five stars,"June 30, 2022"
2666,Faheem Ahmad,No animated enough,Rated 1 stars out of five stars,"January 14, 2023"
2667,Clara Collins,it never sent me the code to sign in,Rated 1 stars out of five stars,"February 9, 2023"
2668,Ibreez Abdallah,Why isn't there a comment option for Android!??,Rated 1 stars out of five stars,"January 25, 2023"
2669,Maha Abdullah,Why can't we delete the pic to everyone? Why that update just for OSi user,Rated 1 stars out of five stars,"September 24, 2022"
2670,D D,Me and my boyfriend love it!! it's so cute🤧,Rated 5 stars out of five stars,"September 15, 2022"
2671,Fatimah Az,the camera quality tho,Rated 3 stars out of five stars,"June 22, 2022"
2672,Juman,"Too bad it doesn't accept my phone number, I don't like it",Rated 1 stars out of five stars,"May 8, 2022"
2673,kim menna,it doesn't work on my phone,Rated 1 stars out of five stars,"December 27, 2022"
2674,Capri Scott (Pri),ITS SAYING THE CODE IS WRONG BUT AS I CHEACKED IT OVER AND OVER STILL NO LUCK,Rated 1 stars out of five stars,"June 9, 2022"
2675,Ludovic goder,Love it and can now see my in other countries ❤️,Rated 4 stars out of five stars,"April 25, 2022"
2676,PARK HERIN,phone number is not accepted 😒,Rated 2 stars out of five stars,"April 18, 2022"
2677,Casey Whaikawa (Freddyateddy),Literally such a cool idea! So fun to use,Rated 5 stars out of five stars,"April 21, 2022"
2678,так получилось,"idk,its not downloading",Rated 2 stars out of five stars,"March 12, 2023"
2679,D'Janae Allen,Not able to get the code to sign up...,Rated 1 stars out of five stars,"August 11, 2022"
2680,Candice Pajarillo,"First if all i dont have a number which i cant use the app, can you just change it to email?",Rated 1 stars out of five stars,"August 17, 2022"
2681,N. X,This app is great but why I need a friend to take photo that's so Bad,Rated 4 stars out of five stars,"April 19, 2022"
2682,Alyss Jenny Kim,Won't accept the verification code for me to use the app,Rated 1 stars out of five stars,"April 18, 2022"
2683,T Bennett,because im not able to put a widget on my android 💔,Rated 1 stars out of five stars,"June 10, 2022"
2684,shivero,please add flashlight to front camera,Rated 4 stars out of five stars,"June 9, 2022"
2685,p-i-e s-u-c-c,Very Bad!! Dont Work In Old Refrigerator! I HAVE NO FRIENDS!! YOU DUCK!!,Rated 1 stars out of five stars,"August 10, 2022"
2686,Jen,Can't add friends at all (android),Rated 1 stars out of five stars,"April 19, 2022"
2687,Tenisha Netia,It's sooo good,Rated 5 stars out of five stars,"October 30, 2022"
2688,winaa,A cute way to share moments with friends 🥰,Rated 5 stars out of five stars,"October 12, 2022"
2689,Put,Love it! Cant wait for more updates,Rated 5 stars out of five stars,"May 21, 2022"
2690,Lama,Can't authenticate my number. Says too many requests,Rated 1 stars out of five stars,"April 19, 2022"
2691,Joyce-e Qiu (Joyce-e),perfect for couple s who can't see each other every day,Rated 5 stars out of five stars,"June 23, 2022"
2692,Asia Brown,This app takes pictures by itself sometimes,Rated 1 stars out of five stars,"August 30, 2022"
2693,m.r Yazeed,It doesn't go to my main camera it's go to micro,Rated 2 stars out of five stars,"June 4, 2022"
2694,B - Ivanrexford f. Rodeo,Add some filter plss,Rated 5 stars out of five stars,"January 25, 2023"
2695,salman aldossary,Android users can't register 😕,Rated 1 stars out of five stars,"May 4, 2022"
2696,Nevaeh Peltier,I like it but it won't let me turn the flash on,Rated 4 stars out of five stars,"June 24, 2022"
2697,Teddy Bär,it won't even let me sign in its sooooo bugged,Rated 1 stars out of five stars,"April 19, 2022"
2698,Mera,"bad and slow, and won't let me sign in",Rated 1 stars out of five stars,"May 8, 2022"
2699,Hoyo Mii,Broo finally i was waiting for this thank you for putting a android version ❤️❤️❤️,Rated 5 stars out of five stars,"April 18, 2022"
2700,Maab Salah,not working at all,Rated 1 stars out of five stars,"April 30, 2022"
2701,M.28,"I love it, another way for me and my loved ones, lover and friends from afar (⁠ ⁠◜⁠‿⁠◝⁠ ⁠)⁠♡",Rated 5 stars out of five stars,"September 28, 2022"
2702,Luqman Abdi,best locker I use when I go to the gym. keeps my belongings safe.,Rated 5 stars out of five stars,"June 26, 2022"
2703,RATEDJAGUAR101,It doesn't send a verification code to my sms,Rated 1 stars out of five stars,"August 1, 2022"
2704,Christine Wong,I wait for hours my sms to give me the code but i still didn't get sms code i try many time is still the same.,Rated 1 stars out of five stars,"April 27, 2022"
2705,blakout god rodriguez,it's good and it's fun with my freinds,Rated 5 stars out of five stars,"September 29, 2022"
2706,thamer_ek8z,I hope it gets updated due to bugs,Rated 1 stars out of five stars,"May 1, 2022"
2707,حاتم الثمالي,I want to set up an account. I'm putting my phone number on. He says try again or try later. I want a solution.,Rated 1 stars out of five stars,"May 1, 2022"
